unique_number,id_no,site_name_en,date_inscribed,danger_list,longitude,latitude,area_hectares,category,category_short,states_name_en,name_en,iso_code,udnp_code1226,1052,Tugendhat Villa in Brno,2001,,16,61605556,49,20718333,0,73,Cultural,C,Czech Republic,Europe and North America,cz,cze1255,1078,Jewish Quarter and St Procopius' Basilica in T_ebí_,2003,,15,87888889,49,21722222,5,73,Cultural,C,Czech Republic,Europe and North America,cz,cze1269,1091,Complex of Koguryo Tombs,2004,,125,415,38,86305556,232,9,Cultural,C,Democratic People's Republic of Korea,Asia and the Pacific,kp,prk1878,1278,Historic Monuments and Sites in Kaesong,2013,,126,5080556,37,98166667,494,2,Cultural,C,Democratic People's Republic of Korea,Asia and the Pacific,kp,prk67,63,Virunga National Park,1979,Y 1994,29,16666667,0,916666667,800000,Natural,N,Democratic Republic of the Congo,Africa,cd,cod149,136,Garamba National Park,1980,Y 1996 P 1984-1992,29,25,4,500000,Natural,N,Democratic Republic of the Congo,Africa,cd,cod150,137,Kahuzi-Biega National Park,1980,Y 1997,28,75,-2,5,600000,Natural,N,Democratic Republic of the Congo,Africa,cd,cod314,280,Salonga National Park,1984,Y 1999,21,-2,3600000,Natural,N,Democratic Republic of the Congo,Africa,cd,cod849,718,Okapi Wildlife Reserve,1996,Y 1997,28,5,2,1372625,Natural,N,Democratic Republic of the Congo,Africa,cd,cod822,695,Roskilde Cathedral,1995,,12,07972222,55,64222222,0,4,Cultural,C,Denmark,Europe and North America,dk,dnk824,696,Kronborg Castle,2000,,12,62083333,56,03889,0,Cultural,C,Denmark,Europe and North America,dk,dnk825,697,Jelling Mounds, Runic Stones and Church,1994,,9,42,55,75638889,4,96,Cultural,C,Denmark,Europe and North America,dk,dnk1330,1149,Ilulissat Icefjord,2004,,-49,5,69,13333333,402400,Natural,N,Denmark,Europe and North America,dk,dnk1973,1416,Stevns Klint,2014,,12,42333333,55,26722222,50,Natural,N,Denmark,Europe and North America,dk,dnk2029,1468,Christiansfeld, a Moravian Church Settlement,2015,,9,481388889,55,35555556,21,2,Cultural,C,Denmark,Europe and North America,dk,dnk2030,1469,The par force hunting landscape in North Zealand,2015,,12,35777778,55,91361111,4543,Cultural,C,Denmark,Europe and North America,dk,dnk962,814,Morne Trois Pitons National Park,1997,,-61,28333333,15,26666667,6857,Natural,N,Dominica,Latin America and the Caribbean,dm,dma5,2,City of Quito,1978,,-78,5,-0,003888889,320,Cultural,C,Ecuador,Latin America and the Caribbean,ec,ecu1014,863,Historic Centre of Santa Ana de los Ríos de Cuenca,1999,,-78,98333333,-2,883333333,224,14,Cultural,C,Ecuador,Latin America and the Caribbean,ec,ecu92,86,Memphis and its Necropolis – the Pyramid Fields from Giza to Dahshur,1979,,31,13041,29,97604,16358,52,Cultural,C,Egypt,Arab States,eg,egy93,87,Ancient Thebes with its Necropolis,1979,,32,6,25,73333,7390,16,Cultural,C,Egypt,Arab States,eg,egy94,88,Nubian Monuments from Abu Simbel to Philae,1979,,31,62611,22,33639,374,48,Cultural,C,Egypt,Arab States,eg,egy95,89,Historic Cairo,1979,,31,26111,30,05,523,66,Cultural,C,Egypt,Arab States,eg,egy96,90,Abu Mena,1979,Y 2001,29,66666667,30,85,182,72,Cultural,C,Egypt,Arab States,eg,egy1116,954,Saint Catherine Area,2002,,33,97543,28,55623,60100,Cultural,C,Egypt,Arab States,eg,egy799,675,Joya de Cerén Archaeological Site,1993,,-89,36916667,13,8275,3200,Cultural,C,El Salvador,Latin America and the Caribbean,sv,slv1626,822,Historic Centre (Old Town) of Tallinn,1997,,24,73333333,59,43333,113,Cultural,C,Estonia,Europe and North America,ee,est12,9,Simien National Park,1978,Y 1996,38,06666667,13,18333333,13600,Natural,N,Ethiopia,Africa,et,eth13,10,Lower Valley of the Awash,1980,,40,57939,11,10006,0,Cultural,C,Ethiopia,Africa,et,eth15,12,Tiya,1980,,38,6121,8,43491,0,Cultural,C,Ethiopia,Africa,et,eth18,15,Aksum,1980,,38,71861,14,13019,0,Cultural,C,Ethiopia,Africa,et,eth20,17,Lower Valley of the Omo,1980,,35,96666667,4,8,0,Cultural,C,Ethiopia,Africa,et,eth21,18,Rock-Hewn Churches, Lalibela,1978,,39,04042,12,02935,0,Cultural,C,Ethiopia,Africa,et,eth22,19,Fasil Ghebbi, Gondar Region,1979,,37,46617,12,60692,0,Cultural,C,Ethiopia,Africa,et,eth1452,1189,Harar Jugol, the Fortified Historic Town,2006,,42,13777778,9,308888889,48,Cultural,C,Ethiopia,Africa,et,eth1846,1333,Konso Cultural Landscape,2011,,37,4,5,3,23000,Cultural,C,Ethiopia,Africa,et,eth1886,1399,Levuka Historical Port Town,2013,,178,8345333,-17,68337778,69,6,Cultural,C,Fiji,Asia and the Pacific,fj,fji686,579,Bronze Age Burial Site of Sammallahdenmäki,1999,,21,7775,61,12056,0,Cultural,C,Finland,Europe and North America,fi,fin1718,582,Old Rauma,1991,,21,51167,61,12806,29,Cultural,C,Finland,Europe and North America,fi,fin1569,80,Mont-Saint-Michel and its Bay,1979,,-1,51056,48,63556,6560,Cultural,C,France,Europe and North America,fr,fra1719,81,Chartres Cathedral,1979,,1,487222222,48,4475,1,06,Cultural,C,France,Europe and North America,fr,fra1571,83,Palace and Park of Versailles,1979,,2,119444444,48,805,1070,Cultural,C,France,Europe and North America,fr,fra1572,84,Vézelay, Church and Hill,1979,,3,748333333,47,46638889,183,Cultural,C,France,Europe and North America,fr,fra91,85,Prehistoric Sites and Decorated Caves of the Vézère Valley,1979,,1,17,45,0575,0,Cultural,C,France,Europe and North America,fr,fra178,160,Palace and Park of Fontainebleau,1981,,2,698055556,48,40194444,144,Cultural,C,France,Europe and North America,fr,fra1951,162,Amiens Cathedral,1981,,2,301666667,49,895,1,54,Cultural,C,France,Europe and North America,fr,fra1568,163,"Roman Theatre and its Surroundings and the ""Triumphal Arch"" of Orange",1981,,4,808416667,44,13572222,9,45,Cultural,C,France,Europe and North America,fr,fra182,164,Arles, Roman and Romanesque Monuments,1981,,4,630694444,43,67763889,65,Cultural,C,France,Europe and North America,fr,fra1565,165,Cistercian Abbey of Fontenay,1981,,4,38911,47,63944,5,77,Cultural,C,France,Europe and North America,fr,fra1637,203,From the Great Saltworks of Salins-les-Bains to the Royal Saltworks of Arc-et-Senans, the Production of Open-pan Salt ,1982,,5,876388889,46,9375,10,48,Cultural,C,France,Europe and North America,fr,fra254,228,Historic Centre of Avignon: Papal Palace, Episcopal Ensemble and Avignon Bridge,1995,,4,806111111,43,95277778,8,2,Cultural,C,France,Europe and North America,fr,fra255,229,Place Stanislas, Place de la Carrière and Place d'Alliance in Nancy,1983,,6,183333333,48,69361111,0,Cultural,C,France,Europe and North America,fr,fra1567,230,Abbey Church of Saint-Savin sur Gartempe,1983,,0,86611,46,56472,0,1584,Cultural,C,France,Europe and North America,fr,fra288,258,Gulf of Porto: Calanche of Piana, Gulf of Girolata, Scandola Reserve,1983,,8,628833333,42,32519444,11800,Natural,N,France,Europe and North America,fr,fra1566,344,Pont du Gard (Roman Aqueduct),1985,,4,535277778,43,94722222,0,3257,Cultural,C,France,Europe and North America,fr,fra393,345,Historic Fortified City of Carcassonne,1997,,2,358888889,43,21055556,11,Cultural,C,France,Europe and North America,fr,fra577,495,Strasbourg – Grande île,1988,,7,73,48,58138889,94,Cultural,C,France,Europe and North America,fr,fra710,600,Paris, Banks of the Seine,1991,,2,294166667,48,85833333,365,Cultural,C,France,Europe and North America,fr,fra711,601,Cathedral of Notre-Dame, Former Abbey of Saint-Rémi and Palace of Tau, Reims,1991,,4,032777778,49,25333333,4,16,Cultural,C,France,Europe and North America,fr,fra1952,635,Bourges Cathedral,1992,,2,398333333,47,08222222,0,85,Cultural,C,France,Europe and North America,fr,fra910,770,Canal du Midi,1996,,1,416388889,43,61138889,1172,Cultural,C,France,Europe and North America,fr,fra1019,868,Routes of Santiago de Compostela in France,1998,,0,722944444,45,18405556,0,Cultural,C,France,Europe and North America,fr,fra1023,872,Historic Site of Lyons,1998,,4,83333,45,76722,427,Cultural,C,France,Europe and North America,fr,fra1025,873,Provins, Town of Medieval Fairs,2001,,3,298888889,48,55972222,108,Cultural,C,France,Europe and North America,fr,fra1088,932,Jurisdiction of Saint-Emilion,1999,,-0,155277778,44,89472222,7847,Cultural,C,France,Europe and North America,fr,fra1089,933,The Loire Valley between Sully-sur-Loire and Chalonnes,2000,,0,70278,47,39889,85394,Cultural,C,France,Europe and North America,fr,fra1531,1115,Lagoons of New Caledonia: Reef Diversity and Associated Ecosystems,2008,,164,5663889,-20,41194444,1574300,Natural,N,France,Europe and North America,fr,fra1848,1153,The Causses and the Cévennes, Mediterranean agro-pastoral Cultural Landscape,2011,,3,473055556,44,22027778,302319,Cultural,C,France,Europe and North America,fr,fra1358,1181,Le Havre, the City Rebuilt by Auguste Perret,2005,,0,1075,49,49278,133,Cultural,C,France,Europe and North America,fr,fra1433,1256,Bordeaux, Port of the Moon,2007,,-0,572222222,44,83888889,1731,Cultural,C,France,Europe and North America,fr,fra1514,1283,Fortifications of Vauban,2008,,2,758888889,50,2825,1153,16,Cultural,C,France,Europe and North America,fr,fra1604,1317,Pitons, cirques and remparts of Reunion Island,2010,,55,48,-21,09944444,105838,Natural,N,France,Europe and North America,fr,fra1663,1337,Episcopal City of Albi,2010,,2,1425,43,92833333,19,47,Cultural,C,France,Europe and North America,fr,fra1776,1360,Nord-Pas de Calais Mining Basin,2012,,3,546111111,50,4625,3943,Cultural,C,France,Europe and North America,fr,fra2016,1425,Climats, terroirs of Burgundy,2015,,4,864444444,47,05805556,13219,Cultural,C,France,Europe and North America,fr,fra1974,1426,Decorated Cave of Pont d’Arc, known as Grotte Chauvet-Pont d’Arc, Ardèche,2014,,4,416111111,44,3875,9,Cultural,C,France,Europe and North America,fr,fra2026,1465,Champagne Hillsides, Houses and Cellars,2015,,3,946111111,49,0775,1101,74,Cultural,C,France,Europe and North America,fr,fra1547,1147,Ecosystem and Relict Cultural Landscape of Lopé-Okanda,2007,,11,5,-0,5,491291,Mixed,C/N,Gabon,Africa,ga,gab897,761,Kunta Kinteh Island and Related Sites,2003,,-16,35719444,13,31616667,7,5981,Cultural,C,Gambia,Africa,gm,gmb838,708,Historical Monuments of Mtskheta,1994,Y 2009,44,71639,41,84389,3,85,Cultural,C,Georgia,Europe and North America,ge,geo839,709,Upper Svaneti,1996,,43,01139,42,91639,1,06,Cultural,C,Georgia,Europe and North America,ge,geo840,710,Bagrati Cathedral and Gelati Monastery,1994,Y 2010,42,71639,42,26222,7,87,Cultural,C,Georgia,Europe and North America,ge,geo1953,3,Aachen Cathedral ,1978,,6,084444444,50,77444444,0,2,Cultural,C,Germany,Europe and North America,de,deu186,168,Speyer Cathedral,1981,,8,443055556,49,31666667,0,Cultural,C,Germany,Europe and North America,de,deu1735,169,Würzburg Residence with the Court Gardens and Residence Square,1981,,9,93889,49,79278,14,77,Cultural,C,Germany,Europe and North America,de,deu1627,187,St Mary's Cathedral and St Michael's Church at Hildesheim,1985,,9,94389,52,15278,0,58,Cultural,C,Germany,Europe and North America,de,deu1864,271,Pilgrimage Church of Wies,1983,,10,90013889,47,68127778,0,1,Cultural,C,Germany,Europe and North America,de,deu1706,272,Hanseatic City of Lübeck,1987,,10,69167,53,86667,81,1,Cultural,C,Germany,Europe and North America,de,deu322,288,Castles of Augustusburg and Falkenlust at Brühl,1984,,6,909777778,50,82502778,89,Cultural,C,Germany,Europe and North America,de,deu1628,292,Cologne Cathedral,1996,P 2004-2006,6,957222222,50,94111111,,Cultural,C,Germany,Europe and North America,de,deu420,367,Roman Monuments, Cathedral of St Peter and Church of Our Lady in Trier,1986,,6,633333333,49,75,0,Cultural,C,Germany,Europe and North America,de,deu1865,515,Abbey and Altenmünster of Lorsch,1991,,8,56858,49,65369,3,34,Cultural,C,Germany,Europe and North America,de,deu624,532,Palaces and Parks of Potsdam and Berlin,1990,,13,03333333,52,4,2064,Cultural,C,Germany,Europe and North America,de,deu627,534,Garden Kingdom of Dessau-Wörlitz,2000,,12,42083,51,8425,14500,Cultural,C,Germany,Europe and North America,de,deu629,535,Collegiate Church, Castle and Old Town of Quedlinburg,1994,,11,15,51,78333,90,Cultural,C,Germany,Europe and North America,de,deu642,546,Maulbronn Monastery Complex,1993,,8,81306,49,00083,0,Cultural,C,Germany,Europe and North America,de,deu1576,623,Mines of Rammelsberg, Historic Town of Goslar and Upper Harz Water Management  System,1992,,10,34,51,82,1009,89,Cultural,C,Germany,Europe and North America,de,deu742,624,Town of Bamberg,1993,,10,88888889,49,89166667,142,Cultural,C,Germany,Europe and North America,de,deu813,687,Völklingen Ironworks,1994,,6,85,49,24444,6,Cultural,C,Germany,Europe and North America,de,deu1733,720,Messel Pit Fossil Site,1995,,8,75389,49,91667,42,Natural,N,Germany,Europe and North America,de,deu861,729,Bauhaus and its Sites in Weimar and Dessau,1996,,11,32949,50,97477,0,Cultural,C,Germany,Europe and North America,de,deu926,783,Luther Memorials in Eisleben and Wittenberg,1996,,12,65278,51,86472,0,Cultural,C,Germany,Europe and North America,de,deu997,846,Classical Weimar,1998,,11,32861,50,9775,0,Cultural,C,Germany,Europe and North America,de,deu1047,896,Museumsinsel (Museum Island), Berlin,1999,,13,39861111,52,51972222,8,6,Cultural,C,Germany,Europe and North America,de,deu1048,897,Wartburg Castle,1999,,10,307,50,96677778,0,Cultural,C,Germany,Europe and North America,de,deu1138,974,Monastic Island of Reichenau,2000,,9,061305556,47,69872222,0,Cultural,C,Germany,Europe and North America,de,deu1139,975,Zollverein Coal Mine Industrial Complex in Essen,2001,,7,046111111,51,49138889,0,Cultural,C,Germany,Europe and North America,de,deu1243,1066,Upper Middle Rhine Valley,2002,,7,694166667,50,17361111,27250,Cultural,C,Germany,Europe and North America,de,deu1244,1067,Historic Centres of Stralsund and Wismar,2002,,13,08527778,54,3025,168,Cultural,C,Germany,Europe and North America,de,deu1265,1087,Town Hall and Roland on the Marketplace of Bremen,2004,,8,807472222,53,07597222,0,287,Cultural,C,Germany,Europe and North America,de,deu1335,1155,Old town of Regensburg with Stadtamhof,2006,,12,09916667,49,02055556,182,8,Cultural,C,Germany,Europe and North America,de,deu1416,1239,Berlin Modernism Housing Estates,2008,,13,45,52,44833333,88,1,Cultural,C,Germany,Europe and North America,de,deu1778,1368,Fagus Factory in Alfeld,2011,,9,811111111,51,98361111,1,88,Cultural,C,Germany,Europe and North America,de,deu1799,1379,Margravial Opera House Bayreuth,2012,,11,57861111,49,94444444,0,19,Cultural,C,Germany,Europe and North America,de,deu1875,1413,Bergpark Wilhelmshöhe,2013,,9,393055556,51,31583333,558,7,Cultural,C,Germany,Europe and North America,de,deu1990,1447,Carolingian Westwork and Civitas Corvey,2014,,9,41025,51,77827778,12,Cultural,C,Germany,Europe and North America,de,deu2028,1467,Speicherstadt and Kontorhaus District with Chilehaus,2015,,9,999444444,53,54555556,26,08,Cultural,C,Germany,Europe and North America,de,deu39,35,Asante Traditional Buildings,1980,,-1,625833333,6,401111111,0,Cultural,C,Ghana,Africa,gh,gha452,392,Temple of Apollo Epicurius at Bassae,1986,,21,89694,37,43498,20,46,Cultural,C,Greece,Europe and North America,gr,grc453,393,Archaeological Site of Delphi,1987,,22,49617,38,48149,51,04,Cultural,C,Greece,Europe and North America,gr,grc467,404,Acropolis, Athens,1987,,23,72618,37,97087,3,04,Cultural,C,Greece,Europe and North America,gr,grc526,454,Mount Athos,1988,,24,21667,40,26667,33042,3,Mixed,C/N,Greece,Europe and North America,gr,grc527,455,Meteora,1988,,21,63333,39,71667,271,87,Mixed,C/N,Greece,Europe and North America,gr,grc528,456,Paleochristian and Byzantine Monuments of Thessalonika,1988,,22,965,40,63833,5,327,Cultural,C,Greece,Europe and North America,gr,grc571,491,Sanctuary of Asklepios at Epidaurus,1988,,23,11666667,37,66666667,1393,8,Cultural,C,Greece,Europe and North America,gr,grc574,493,Medieval City of Rhodes,1988,,28,22778,36,44722,65,85,Cultural,C,Greece,Europe and North America,gr,grc595,511,Archaeological Site of Mystras,1989,,22,36667,37,08056,54,43,Cultural,C,Greece,Europe and North America,gr,grc603,517,Archaeological Site of Olympia,1989,,21,66666667,37,65,105,6,Cultural,C,Greece,Europe and North America,gr,grc620,530,Delos,1990,,25,26667,37,4,350,64,Cultural,C,Greece,Europe and North America,gr,grc632,537,Monasteries of Daphni, Hosios Loukas and Nea Moni of Chios,1990,,22,75,38,4,3,7,Cultural,C,Greece,Europe and North America,gr,grc703,595,Pythagoreion and Heraion of Samos,1992,,26,94333,37,69083,668,35,Cultural,C,Greece,Europe and North America,gr,grc923,780,Archaeological Site of Aigai (modern name Vergina),1996,,22,31833,40,47139,1420,81,Cultural,C,Greece,Europe and North America,gr,grc1097,941,Archaeological Sites of Mycenae and Tiryns,1999,,22,75,37,73333333,0,Cultural,C,Greece,Europe and North America,gr,grc1098,942,The Historic Centre (Chorá) with the Monastery of Saint-John the Theologian and the Cave of the Apocalypse on the Island of Pátmos,1999,,26,55,37,3,0,Cultural,C,Greece,Europe and North America,gr,grc1477,978,Old Town of Corfu,2007,,19,9275,39,62394139,70,Cultural,C,Greece,Europe and North America,gr,grc68,64,Tikal National Park,1979,,-89,61666667,17,21666667,57600,Mixed,C/N,Guatemala,Latin America and the Caribbean,gt,gtm69,65,Antigua Guatemala,1979,,-90,66666667,14,56666667,0,Cultural,C,Guatemala,Latin America and the Caribbean,gt,gtm167,149,Archaeological Park and Ruins of Quirigua,1981,,-89,04025,15,27059,0,Cultural,C,Guatemala,Latin America and the Caribbean,gt,gtm199,180,National History Park – Citadel, Sans Souci, Ramiers,1982,,-72,24417,19,57361,0,Cultural,C,Haiti,Latin America and the Caribbean,ht,hti320,286,Vatican City,1984,,12,45736,41,90216,0,Cultural,C,Holy See,Europe and North America,va,vat141,129,Maya Site of Copan,1980,,-89,13333,14,85,0,Cultural,C,Honduras,Latin America and the Caribbean,hn,hnd217,196,Río Plátano Biosphere Reserve,1982,Y 2011 P 1996-2007,-84,675,15,74444444,350000,Natural,N,Honduras,Latin America and the Caribbean,hn,hnd462,400,Budapest, including the Banks of the Danube, the Buda Castle Quarter and Andrássy Avenue,1987,,19,07067,47,48242,473,3,Cultural,C,Hungary,Europe and North America,hu,hun464,401,Old Village of Hollók_ and its Surroundings,1987,,19,52917,47,99444,144,5,Cultural,C,Hungary,Europe and North America,hu,hun552,474,Hortobágy National Park - the <i>Puszta</i>,1999,,21,15678,47,59458,74820,Cultural,C,Hungary,Europe and North America,hu,hun893,758,Millenary Benedictine Abbey of Pannonhalma and its Natural Environment,1996,,17,78444,47,55889,47,4,Cultural,C,Hungary,Europe and North America,hu,hun1004,853,Early Christian Necropolis of Pécs (Sopianae),2000,,18,22778,46,07444,3,76,Cultural,C,Hungary,Europe and North America,hu,hun1240,1063,Tokaj Wine Region Historic Cultural Landscape,2002,,21,35,48,15,13255,Cultural,C,Hungary,Europe and North America,hu,hun1333,1152,_ingvellir National Park,2004,,-21,03725,64,25380556,9270,Cultural,C,Iceland,Europe and North America,is,isl1532,1267,Surtsey,2008,,-20,60222222,63,30305556,3370,Natural,N,Iceland,Europe and North America,is,isl1460,231,Red Fort Complex,2007,,77,24083333,28,65555556,49,1815,Cultural,C,India,Asia and the Pacific,in,ind258,232,Humayun's Tomb, Delhi,1993,,77,25056,28,59333,0,Cultural,C,India,Asia and the Pacific,in,ind259,233,Qutb Minar and its Monuments, Delhi,1993,,77,18528,28,52583,0,Cultural,C,India,Asia and the Pacific,in,ind260,234,Churches and Convents of Goa,1986,,73,91167,15,50222,0,Cultural,C,India,Asia and the Pacific,in,ind266,239,Group of Monuments at Pattadakal,1987,,75,81667,15,94833,5,56,Cultural,C,India,Asia and the Pacific,in,ind267,240,Khajuraho Group of Monuments,1986,,79,92222,24,85222,0,Cultural,C,India,Asia and the Pacific,in,ind1932,241,Group of Monuments at Hampi,1986,P 1999-2006,76,47167,15,31444,4187,24,Cultural,C,India,Asia and the Pacific,in,ind269,242,Ajanta Caves,1983,,75,7,20,55333,8242,Cultural,C,India,Asia and the Pacific,in,ind270,243,Ellora Caves,1983,,75,17917,20,02639,0,Cultural,C,India,Asia and the Pacific,in,ind272,244,Elephanta Caves,1987,,72,93583,18,96667,0,Cultural,C,India,Asia and the Pacific,in,ind274,246,Sun Temple, Konârak,1984,,86,09472,19,8875,10,62,Cultural,C,India,Asia and the Pacific,in,ind1947,247,Hill Forts of Rajasthan,2013,,74,64611111,24,88333333,,Cultural,C,India,Asia and the Pacific,in,ind277,249,Group of Monuments at Mahabalipuram,1984,,80,19167,12,61667,0,Cultural,C,India,Asia and the Pacific,in,ind280,250,Great Living Chola Temples,1987,,79,1325,10,78305556,21,88,Cultural,C,India,Asia and the Pacific,in,ind281,251,Agra Fort,1983,,78,03333333,27,18333333,0,Cultural,C,India,Asia and the Pacific,in,ind282,252,Taj Mahal,1983,,78,04222,27,17417,0,Cultural,C,India,Asia and the Pacific,in,ind285,255,Fatehpur Sikri,1986,,77,66417,27,09444,0,Cultural,C,India,Asia and the Pacific,in,ind382,335,Nanda Devi and Valley of Flowers National Parks  ,1988,,79,66667,30,71667,71783,Natural,N,India,Asia and the Pacific,in,ind384,337,Kaziranga National Park,1985,,93,41666667,26,66666667,42996,Natural,N,India,Asia and the Pacific,in,ind385,338,Manas Wildlife Sanctuary,1985,Y 1992-2011,91,03055556,26,725,39100,Natural,N,India,Asia and the Pacific,in,ind387,340,Keoladeo National Park,1985,,77,50861111,27,15888889,2873,Natural,N,India,Asia and the Pacific,in,ind613,524,Buddhist Monuments at Sanchi,1989,,77,73972,23,47944,0,Cultural,C,India,Asia and the Pacific,in,ind2008,922,Rani-ki-Vav (the Queen’s Stepwell) at Patan, Gujarat,2014,,72,10166667,23,85888889,4,68,Cultural,C,India,Asia and the Pacific,in,ind1079,925,Rock Shelters of Bhimbetka,2003,,77,58333333,22,92777778,1893,Cultural,C,India,Asia and the Pacific,in,ind1540,944,Mountain Railways of India,1999,,76,93583,11,51028,88,99,Cultural,C,India,Asia and the Pacific,in,ind1105,945,Chhatrapati Shivaji Terminus (formerly Victoria Terminus),2004,,72,83620278,18,94012222,2,85,Cultural,C,India,Asia and the Pacific,in,ind1231,1056,Mahabodhi Temple Complex at Bodh Gaya,2002,,84,99389,24,69528,4,86,Cultural,C,India,Asia and the Pacific,in,ind1279,1101,Champaner-Pavagadh Archaeological Park,2004,,73,53333333,22,48333333,1328,89,Cultural,C,India,Asia and the Pacific,in,ind1677,1338,The Jantar Mantar, Jaipur,2010,,75,825,26,92472222,1,8652,Cultural,C,India,Asia and the Pacific,in,ind1921,1342,Western Ghats,2012,,77,24972222,8,529722222,795315,Natural,N,India,Asia and the Pacific,in,ind2011,1406,Great Himalayan National Park Conservation Area,2014,,77,58333333,31,83333333,90540,Natural,N,India,Asia and the Pacific,in,ind700,592,Borobudur Temple Compounds,1991,,110,20361,-7,60778,25,51,Cultural,C,Indonesia,Asia and the Pacific,id,idn701,593,Sangiran Early Man Site,1996,,110,8166667,-7,4,5600,Cultural,C,Indonesia,Asia and the Pacific,id,idn722,608,Ujung Kulon National Park,1991,,105,3333333,-6,75,78525,Natural,N,Indonesia,Asia and the Pacific,id,idn762,642,Prambanan Temple Compounds,1991,,110,49167,-7,75222,0,Cultural,C,Indonesia,Asia and the Pacific,id,idn1836,1194,Cultural Landscape of Bali Province: the <em>Subak</em> System as a Manifestation of the <em>Tri Hita Karana</em> Philosophy,2012,,115,4027778,-8,259166667,19519,9,Cultural,C,Indonesia,Asia and the Pacific,id,idn122,113,Tchogha Zanbil,1979,,48,53333333,32,0833,0,Cultural,C,Iran (Islamic Republic of),Asia and the Pacific,ir,irn123,114,Persepolis,1979,,52,89028,29,93444,12,5,Cultural,C,Iran (Islamic Republic of),Asia and the Pacific,ir,irn125,115,Meidan Emam, Esfahan,1979,,51,67777778,32,65745,0,Cultural,C,Iran (Islamic Republic of),Asia and the Pacific,ir,irn1254,1077,Takht-e Soleyman,2003,,47,235,36,60388889,10,Cultural,C,Iran (Islamic Republic of),Asia and the Pacific,ir,irn1284,1106,Pasargadae,2004,,53,16729,30,19383,159,65,Cultural,C,Iran (Islamic Republic of),Asia and the Pacific,ir,irn1365,1188,Soltaniyeh,2005,,48,79667,36,43528,790,14,Cultural,C,Iran (Islamic Republic of),Asia and the Pacific,ir,irn1564,1208,Bam and its Cultural Landscape,2004,,58,36666667,29,11683,0,Cultural,C,Iran (Islamic Republic of),Asia and the Pacific,ir,irn1399,1222,Bisotun,2006,0,47,43666667,34,38833333,187,Cultural,C,Iran (Islamic Republic of),Asia and the Pacific,ir,irn1542,1262,Armenian Monastic Ensembles of Iran,2008,,45,47333333,38,97888889,129,2819,Cultural,C,Iran (Islamic Republic of),Asia and the Pacific,ir,irn1599,1315,Shushtar Historical Hydraulic System,2009,,48,83583333,32,01861111,240,4152,Cultural,C,Iran (Islamic Republic of),Asia and the Pacific,ir,irn1680,1345,Sheikh Safi al-din Kh_neg_h and Shrine Ensemble in Ardabil,2010,,48,29138889,38,24861111,2,1353,Cultural,C,Iran (Islamic Republic of),Asia and the Pacific,ir,irn1681,1346,Tabriz Historic Bazaar Complex,2010,,46,29305556,38,08138889,28,9733,Cultural,C,Iran (Islamic Republic of),Asia and the Pacific,ir,irn1768,1372,The Persian Garden,2011,,53,16666667,30,16666667,716,35,Cultural,C,Iran (Islamic Republic of),Asia and the Pacific,ir,irn1821,1397,Masjed-e J_mé of Isfahan  ,2012,,51,68527778,32,66972222,2,0756,Cultural,C,Iran (Islamic Republic of),Asia and the Pacific,ir,irn1822,1398,Gonbad-e Q_bus,2012,,55,169,37,25802778,1,4754,Cultural,C,Iran (Islamic Republic of),Asia and the Pacific,ir,irn1888,1422,Golestan Palace,2013,,51,42051111,35,68036667,5,3,Cultural,C,Iran (Islamic Republic of),Asia and the Pacific,ir,irn2073,1423,Cultural Landscape of Maymand,2015,,55,37555556,30,16805556,4953,85,Cultural,C,Iran (Islamic Republic of),Asia and the Pacific,ir,irn1999,1455,Susa,2015,,48,25611111,32,18944444,350,Cultural,C,Iran (Islamic Republic of),Asia and the Pacific,ir,irn2000,1456,Shahr-i Sokhta,2014,,61,32777778,30,59388889,275,Cultural,C,Iran (Islamic Republic of),Asia and the Pacific,ir,irn1456,276,Samarra Archaeological City,2007,Y 2007,43,82354306,34,34098944,15058,Cultural,C,Iraq,Arab States,iq,irq309,277,Hatra,1985,,42,71833,35,58806,323,75,Cultural,C,Iraq,Arab States,iq,irq1310,1130,Ashur (Qal'at Sherqat),2003,Y 2003,43,25972,35,45889,70,Cultural,C,Iraq,Arab States,iq,irq