unique_number,id_no,site_name_en,date_inscribed,danger_list,longitude,latitude,area_hectares,category,category_short,states_name_en,name_en,iso_code,udnp_code1980,1437,Erbil Citadel,2014,,44,00916667,36,19111111,15,6,Cultural,C,Iraq,Arab States,iq,irq780,659,Brú na Bóinne - Archaeological Ensemble of the Bend of the Boyne,1993,,-6,45,53,69167,770,Cultural,C,Ireland,Europe and North America,ie,irl1214,1040,Masada,2001,,35,35275,31,3135,276,Cultural,C,Israel,Europe and North America,il,isr1217,1042,Old City of Acre,2001,,35,08388889,32,92833333,63,3,Cultural,C,Israel,Europe and North America,il,isr1274,1096,White City of Tel-Aviv -- the Modern Movement,2003,,34,78333333,32,06666667,140,4,Cultural,C,Israel,Europe and North America,il,isr1286,1107,Incense Route - Desert Cities in the Negev,2005,,35,16083,30,54111,6655,Cultural,C,Israel,Europe and North America,il,isr1287,1108,Biblical Tels - Megiddo, Hazor, Beer Sheba,2005,,35,18222,32,59722,96,04,Cultural,C,Israel,Europe and North America,il,isr1581,1220,Bahá’i Holy Places in Haifa and the Western Galilee,2008,,34,97164889,32,82939667,62,58,Cultural,C,Israel,Europe and North America,il,isr1969,1370,Caves of Maresha and Bet-Guvrin in the Judean Lowlands as a Microcosm of the Land of the Caves,2014,,34,89555556,31,6,259,Cultural,C,Israel,Europe and North America,il,isr1818,1393,Sites of Human Evolution at Mount Carmel: The Nahal Me’arot / Wadi el-Mughara Caves,2012,,34,96527778,32,67,54,Cultural,C,Israel,Europe and North America,il,isr2032,1471,Necropolis of Bet She’arim: A Landmark of Jewish Renewal,2015,,35,12694444,32,70222222,12,2,Cultural,C,Israel,Europe and North America,il,isr100,93,Church and Dominican Convent of Santa Maria delle Grazie with “The Last Supper” by Leonardo da Vinci,1980,,9,1705,45,46588889,1,5,Cultural,C,Italy,Europe and North America,it,ita101,94,Rock Drawings in Valcamonica,1979,,10,29733333,45,95705556,432,3,Cultural,C,Italy,Europe and North America,it,ita193,174,Historic Centre of Florence,1982,,11,25611,43,77306,505,Cultural,C,Italy,Europe and North America,it,ita1891,175,Medici Villas and Gardens in Tuscany,2013,,11,30416667,43,85777778,125,4,Cultural,C,Italy,Europe and North America,it,ita454,394,Venice and its Lagoon,1987,,12,33894444,45,43430556,0,Cultural,C,Italy,Europe and North America,it,ita1558,395,Piazza del Duomo, Pisa,1987,,10,39638889,43,72305556,8,87,Cultural,C,Italy,Europe and North America,it,ita459,398,Castel del Monte,1996,,16,27094444,41,08480556,3,1,Cultural,C,Italy,Europe and North America,it,ita646,549,18th-Century Royal Palace at Caserta with the Park, the Aqueduct of Vanvitelli, and the San Leucio Complex,1997,,14,32639,41,07333,87,37,Cultural,C,Italy,Europe and North America,it,ita647,550,Historic Centre of San Gimignano,1990,,11,04167,43,46806,13,88,Cultural,C,Italy,Europe and North America,it,ita793,670,The Sassi and the Park of the Rupestrian Churches of Matera,1993,,16,61027778,40,66638889,1016,Cultural,C,Italy,Europe and North America,it,ita843,712,City of Vicenza and the Palladian Villas of the Veneto,1994,,11,54944444,45,54916667,333,87,Cultural,C,Italy,Europe and North America,it,ita848,717,Historic Centre of Siena,1995,,11,33166667,43,31861111,170,Cultural,C,Italy,Europe and North America,it,ita1867,726,Historic Centre of Naples,1995,,14,26277778,40,85138889,1021,Cultural,C,Italy,Europe and North America,it,ita862,730,Crespi d'Adda,1995,,9,53833,45,59333,0,Cultural,C,Italy,Europe and North America,it,ita867,733,Ferrara, City of the Renaissance, and its Po Delta,1995,,11,61944444,44,83777778,46712,Cultural,C,Italy,Europe and North America,it,ita930,787,The <I>Trulli</I> of Alberobello,1996,,17,23694,40,7825,10,52,Cultural,C,Italy,Europe and North America,it,ita931,788,Early Christian Monuments of Ravenna,1996,,12,19625,44,42041667,1,32,Cultural,C,Italy,Europe and North America,it,ita932,789,Historic Centre of the City of Pienza,1996,,11,67861111,43,07694444,4,41,Cultural,C,Italy,Europe and North America,it,ita942,797,City of Verona,2000,,10,99388889,45,43861111,452,9,Cultural,C,Italy,Europe and North America,it,ita1736,823,Residences of the Royal House of Savoy,1997,,7,68572,45,07253,370,82,Cultural,C,Italy,Europe and North America,it,ita973,824,Botanical Garden (Orto Botanico), Padua,1997,,11,88066667,45,39911111,2,2,Cultural,C,Italy,Europe and North America,it,ita974,825,Archaeological Area and the Patriarchal Basilica of Aquileia,1998,,13,3675,45,76833333,155,3,Cultural,C,Italy,Europe and North America,it,ita975,826,Portovenere, Cinque Terre, and the Islands (Palmaria, Tino and Tinetto),1997,,9,72917,44,10694,4689,25,Cultural,C,Italy,Europe and North America,it,ita976,827,Cathedral, Torre Civica and Piazza Grande, Modena,1997,,10,92568,44,64624,1,2,Cultural,C,Italy,Europe and North America,it,ita977,828,Historic Centre of Urbino,1998,,12,63333,43,725,29,23,Cultural,C,Italy,Europe and North America,it,ita978,829,Archaeological Areas of Pompei, Herculaneum and Torre Annunziata,1997,,14,48333333,40,75,98,05,Cultural,C,Italy,Europe and North America,it,ita979,830,Costiera Amalfitana,1997,,14,6,40,65,11231,Cultural,C,Italy,Europe and North America,it,ita980,831,Archaeological Area of Agrigento,1997,,13,59333333,37,28972222,934,Cultural,C,Italy,Europe and North America,it,ita981,832,Villa Romana del Casale,1997,,14,33417,37,36611,8,92,Cultural,C,Italy,Europe and North America,it,ita982,833,Su Nuraxi di Barumini,1997,,8,991388889,39,70583333,2,3254,Cultural,C,Italy,Europe and North America,it,ita993,842,Cilento and Vallo di Diano National Park with the Archeological Sites of Paestum and Velia, and the Certosa di Padula,1998,,15,26666667,40,28333333,159109,73,Cultural,C,Italy,Europe and North America,it,ita1060,907,Villa Adriana (Tivoli),1999,,12,77197222,41,94416667,80,Cultural,C,Italy,Europe and North America,it,ita1061,908,Isole Eolie (Aeolian Islands),2000,,14,94558333,38,48786111,1216,Natural,N,Italy,Europe and North America,it,ita1154,990,Assisi, the Basilica of San Francesco and Other Franciscan Sites,2000,,12,62244444,43,06616667,14563,25,Cultural,C,Italy,Europe and North America,it,ita1196,1024,Late Baroque Towns of the Val di Noto (South-Eastern Sicily),2002,,15,06891667,36,89319444,112,79,Cultural,C,Italy,Europe and North America,it,ita1197,1025,Villa d'Este, Tivoli,2001,,12,79625,41,96391667,4,5,Cultural,C,Italy,Europe and North America,it,ita1199,1026,Val d'Orcia,2004,,11,55,43,06666667,61187,9609,Cultural,C,Italy,Europe and North America,it,ita1245,1068,<I>Sacri Monti</I> of Piedmont and Lombardy,2003,,9,169555556,45,97455556,90,5,Cultural,C,Italy,Europe and North America,it,ita1338,1158,Etruscan Necropolises of Cerveteri and Tarquinia,2004,,12,10188889,42,00683333,326,93,Cultural,C,Italy,Europe and North America,it,ita1377,1200,Syracuse and the Rocky Necropolis of Pantalica,2005,,15,29306,37,05944,898,46,Cultural,C,Italy,Europe and North America,it,ita1388,1211,Genoa: <i>Le Strade Nuove</i> and the system of the<i> Palazzi dei Rolli</i>,2006,0,8,931111111,44,41222222,15,777,Cultural,C,Italy,Europe and North America,it,ita1609,1237,The Dolomites,2009,,12,16305556,46,61305556,141902,8,Natural,N,Italy,Europe and North America,it,ita1518,1287,Mantua and Sabbioneta,2008,,10,79444444,45,15944444,235,Cultural,C,Italy,Europe and North America,it,ita1780,1318,Longobards in Italy. Places of the Power (568-774 A.D.),2011,,13,43305556,46,09416667,14,08,Cultural,C,Italy,Europe and North America,it,ita1971,1390,Vineyard Landscape of Piedmont: Langhe-Roero and Monferrato,2014,,7,963611111,44,60861111,10789,Cultural,C,Italy,Europe and North America,it,ita1910,1427,Mount Etna,2013,,14,99666667,37,75611111,19237,Natural,N,Italy,Europe and North America,it,ita2048,1487,Arab-Norman Palermo and the Cathedral Churches of Cefalú and Monreale,2015,,13,35305556,38,11083333,6,235,Cultural,C,Italy,Europe and North America,it,ita2015,1356,Blue and John Crow Mountains ,2015,,-76,57111111,18,0775,26251,6,Mixed,C/N,Jamaica,Latin America and the Caribbean,jm,jam781,660,Buddhist Monuments in the Horyu-ji Area,1993,,135,7333333,34,61666667,15,03,Cultural,C,Japan,Asia and the Pacific,jp,jpn782,661,Himeji-jo,1993,,134,7,34,83333333,107,Cultural,C,Japan,Asia and the Pacific,jp,jpn783,662,Yakushima,1993,,130,5333333,30,33333333,10747,Natural,N,Japan,Asia and the Pacific,jp,jpn784,663,Shirakami-Sanchi,1993,,140,13,40,47,16971,Natural,N,Japan,Asia and the Pacific,jp,jpn814,688,Historic Monuments of Ancient Kyoto (Kyoto, Uji and Otsu Cities),1994,,135,7694444,34,98055556,1056,Cultural,C,Japan,Asia and the Pacific,jp,jpn868,734,Historic Villages of Shirakawa-go and Gokayama,1995,,136,8833333,36,4,68,Cultural,C,Japan,Asia and the Pacific,jp,jpn917,775,Hiroshima Peace Memorial (Genbaku Dome),1996,,132,45,34,38333333,0,4,Cultural,C,Japan,Asia and the Pacific,jp,jpn918,776,Itsukushima Shinto Shrine,1996,,132,3246389,34,29441667,431,2,Cultural,C,Japan,Asia and the Pacific,jp,jpn1021,870,Historic Monuments of Ancient Nara,1998,,135,8394444,34,67555556,617,Cultural,C,Japan,Asia and the Pacific,jp,jpn1066,913,Shrines and Temples of Nikko,1999,,139,6105556,36,7475,50,8,Cultural,C,Japan,Asia and the Pacific,jp,jpn1136,972,Gusuku Sites and Related Properties of the Kingdom of Ryukyu,2000,,127,6827778,26,20861111,54,9,Cultural,C,Japan,Asia and the Pacific,jp,jpn1323,1142,Sacred Sites and Pilgrimage Routes in the Kii Mountain Range,2004,,135,7763889,33,83694444,495,3,Cultural,C,Japan,Asia and the Pacific,jp,jpn1370,1193,Shiretoko,2005,,144,96583,43,94944,71100,Natural,N,Japan,Asia and the Pacific,jp,jpn1737,1246,Iwami Ginzan Silver Mine and its Cultural Landscape,2007,,132,435,35,11277778,529,17,Cultural,C,Japan,Asia and the Pacific,jp,jpn1771,1277,Hiraizumi – Temples, Gardens and Archaeological Sites Representing the Buddhist Pure Land,2011,,141,1077778,39,00111111,176,2,Cultural,C,Japan,Asia and the Pacific,jp,jpn1770,1362,Ogasawara Islands,2011,,142,0997222,27,71833333,7939,Natural,N,Japan,Asia and the Pacific,jp,jpn1883,1418,Fujisan, sacred place and source of artistic inspiration,2013,,138,7275,35,36083333,20702,1,Cultural,C,Japan,Asia and the Pacific,jp,jpn1992,1449,Tomioka Silk Mill and Related Sites,2014,,138,8877778,36,25527778,7,2,Cultural,C,Japan,Asia and the Pacific,jp,jpn2045,1484,Sites of Japan’s Meiji Industrial Revolution: Iron and Steel, Shipbuilding and Coal Mining,2015,,131,4122222,34,43055556,306,66,Cultural,C,Japan,Asia and the Pacific,jp,jpn165,148,Old City of Jerusalem and its Walls,1981,Y 1982,35,21666667,31,78333333,0,Cultural,C,Jerusalem (Site proposed by Jordan),Arab States,,370,326,Petra,1985,,35,44333,30,33056,26171,Cultural,C,Jordan,Arab States,jo,jor372,327,Quseir Amra,1985,,36,58583,31,80194,0,Cultural,C,Jordan,Arab States,jo,jor1271,1093,Um er-Rasas (Kastrom Mefa'a),2004,,35,92056,31,50167,23,928,Cultural,C,Jordan,Arab States,jo,jor1758,1377,Wadi Rum Protected Area,2011,,35,43388889,29,63972222,74179,7,Mixed,C/N,Jordan,Arab States,jo,jor2019,1446,Baptism Site “Bethany Beyond the Jordan” (Al-Maghtas),2015,,35,55277778,31,83722222,294,155,Cultural,C,Jordan,Arab States,jo,jor1543,1102,Saryarka – Steppe and Lakes of Northern Kazakhstan,2008,,69,18888889,50,43333333,450344,Natural,N,Kazakhstan,Asia and the Pacific,kz,kaz1281,1103,Mausoleum of Khoja Ahmed Yasawi,2003,,68,27444444,43,29305556,0,55,Cultural,C,Kazakhstan,Asia and the Pacific,kz,kaz1326,1145,Petroglyphs within the Archaeological Landscape of Tamgaly,2004,,75,535,43,80333333,900,Cultural,C,Kazakhstan,Asia and the Pacific,kz,kaz1902,800,Mount Kenya National Park/Natural Forest,1997,,37,31555556,-0,155,202334,Natural,N,Kenya,Africa,ke,ken947,801,Lake Turkana National Parks,1997,,36,50366667,3,051305556,161485,Natural,N,Kenya,Africa,ke,ken1229,1055,Lamu Old Town,2001,,40,8525,-2,284444444,15,6,Cultural,C,Kenya,Africa,ke,ken1749,1060,Kenya Lake System in the Great Rift Valley,2011,,36,24,-0,4425,32034,Natural,N,Kenya,Africa,ke,ken1589,1231,Sacred Mijikenda Kaya Forests,2008,,39,59611111,-3,931944444,1538,Cultural,C,Kenya,Africa,ke,ken1847,1295,Fort Jesus, Mombasa,2011,,39,67944444,-4,062777778,2,36,Cultural,C,Kenya,Africa,ke,ken1683,1325,Phoenix Islands Protected Area,2010,,-172,8575,-3,649722222,40825000,Natural,N,Kiribati,Asia and the Pacific,ki,kir1699,1230,Sulaiman-Too Sacred Mountain,2009,,72,78277778,40,53111111,112,Cultural,C,Kyrgyzstan,Asia and the Pacific,kg,kgz1954,479,Town of Luang Prabang,1995,,102,13333,19,88889,820,Cultural,C,Lao People's Democratic Republic,Asia and the Pacific,la,lao560,481,Vat Phou and Associated Ancient Settlements within the Champasak Cultural Landscape,2001,,105,8222222,14,84833333,39000,Cultural,C,Lao People's Democratic Republic,Asia and the Pacific,la,lao1003,852,Historic Centre of Riga,1997,,24,11667,56,95417,438,3,Cultural,C,Latvia,Europe and North America,lv,lva329,293,Anjar,1984,,35,92972,33,72583,0,Cultural,C,Lebanon,Arab States,lb,lbn330,294,Baalbek,1984,,36,20494,34,00707,0,Cultural,C,Lebanon,Arab States,lb,lbn331,295,Byblos,1984,,35,6475,34,11917,0,Cultural,C,Lebanon,Arab States,lb,lbn335,299,Tyre,1984,,35,19444,33,27194,153,8,Cultural,C,Lebanon,Arab States,lb,lbn203,183,Archaeological Site of Leptis Magna,1982,,14,29306,32,63833,0,Cultural,C,Libya,Arab States,ly,lby204,184,Archaeological Site of Sabratha,1982,,12,485,32,80528,0,Cultural,C,Libya,Arab States,ly,lby211,190,Archaeological Site of Cyrene,1982,,21,85833,32,825,0,Cultural,C,Libya,Arab States,ly,lby321,287,Rock-Art Sites of Tadrart Acacus,1985,,10,33333,24,83333,0,Cultural,C,Libya,Arab States,ly,lby415,362,Old Town of Ghadamès,1986,,9,5,30,13333333,0,Cultural,C,Libya,Arab States,ly,lby1929,541,Vilnius Historic Centre,1994,,25,29306,54,68667,352,09,Cultural,C,Lithuania,Europe and North America,lt,ltu1317,1137,Kernav_  Archaeological Site (Cultural Reserve of Kernav_),2004,,24,83055556,54,88777778,194,4,Cultural,C,Lithuania,Europe and North America,lt,ltu827,699,City of Luxembourg: its Old Quarters and Fortifications,1994,,6,13333,49,61,29,94,Cultural,C,Luxembourg,Europe and North America,lu,lux1434,1257,Rainforests of the Atsinanana,2007,,49,7025,-14,45972222,479660,7,Natural,N,Madagascar,Africa,mg,mdg323,289,Lake Malawi National Park,1984,,34,88333,-14,03333,9400,Natural,N,Malawi,Africa,mw,mwi1450,476,Chongoni Rock-Art Area,2006,,34,27916667,-14,29333333,12640,Cultural,C,Malawi,Africa,mw,mwi1182,1012,Kinabalu Park,2000,,116,5,6,25,75370,Natural,N,Malaysia,Asia and the Pacific,my,mys1183,1013,Gunung Mulu National Park,2000,,114,91667,4,13333,52864,Natural,N,Malaysia,Asia and the Pacific,my,mys1871,1223,Melaka and George Town, Historic Cities of the Straits of Malacca,2008,,100,3458333,5,421388889,218,76,Cultural,C,Malaysia,Asia and the Pacific,my,mys1820,1396,Archaeological Heritage of the Lenggong Valley,2012,,100,9723278,5,067908333,398,64,Cultural,C,Malaysia,Asia and the Pacific,my,mys127,116,Old Towns of Djenné,1988,,-4,555,13,90639,0,Cultural,C,Mali,Africa,ml,mli131,119,Timbuktu,1988,Y 2012 P 1990-2005,-2,999444444,16,77333333,0,Cultural,C,Mali,Africa,ml,mli602,516,Cliff of Bandiagara (Land of the Dogons),1989,,-3,41667,14,33333,327390,Mixed,C/N,Mali,Africa,ml,mli1320,1139,Tomb of Askia,2004,Y 2012,-0,04456,16,2898,4,24,Cultural,C,Mali,Africa,ml,mli142,130,_al Saflieni Hypogeum,1980,,14,50739,35,87134,0,13,Cultural,C,Malta,Europe and North America,mt,mlt143,131,City of Valletta,1980,,14,51444,35,90056,55,5,Cultural,C,Malta,Europe and North America,mt,mlt1684,1339,Bikini Atoll Nuclear Test Site,2010,,165,3805556,11,6,73500,Cultural,C,Marshall Islands,Asia and the Pacific,mh,mhl590,506,Banc d'Arguin National Park,1989,,-16,10889,20,23472,1200000,Natural,N,Mauritania,Arab States,mr,mrt1860,1259,Le Morne Cultural Landscape,2008,,57,32833333,-20,45194444,349,6,Cultural,C,Mauritius,Africa,mu,mus473,410,Sian Ka'an,1987,,-87,79167,19,38333,528000,Natural,N,Mexico,Latin America and the Caribbean,mx,mex474,411,Pre-Hispanic City and National Park of Palenque,1987,,-92,05,17,48333,1772,Cultural,C,Mexico,Latin America and the Caribbean,mx,mex475,412,Historic Centre of Mexico City and Xochimilco,1987,,-99,13278,19,41833,0,Cultural,C,Mexico,Latin America and the Caribbean,mx,mex477,414,Pre-Hispanic City of Teotihuacan,1987,,-98,84167,19,69167,3381,71,Cultural,C,Mexico,Latin America and the Caribbean,mx,mex478,415,Historic Centre of Oaxaca and Archaeological Site of Monte Albán,1987,,-96,72167,17,06194,375,Cultural,C,Mexico,Latin America and the Caribbean,mx,mex479,416,Historic Centre of Puebla,1987,,-98,20833,19,04722,690,Cultural,C,Mexico,Latin America and the Caribbean,mx,mex561,482,Historic Town of Guanajuato and Adjacent Mines,1988,,-101,25556,21,01694,2167,5,Cultural,C,Mexico,Latin America and the Caribbean,mx,mex562,483,Pre-Hispanic City of Chichen-Itza,1988,,-88,6,20,66667,0,Cultural,C,Mexico,Latin America and the Caribbean,mx,mex652,554,Whale Sanctuary of El Vizcaino,1993,,-114,22778,27,79222,369631,Natural,N,Mexico,Latin America and the Caribbean,mx,mex662,560,Archaeological Zone of Paquimé, Casas Grandes,1998,,-107,95556,30,37583,146,72,Cultural,C,Mexico,Latin America and the Caribbean,mx,mex692,585,Historic Centre of Morelia,1991,,-101,19167,19,70444,390,Cultural,C,Mexico,Latin America and the Caribbean,mx,mex749,631,El Tajin, Pre-Hispanic City,1992,,-97,3775,20,47639,240,Cultural,C,Mexico,Latin America and the Caribbean,mx,mex800,676,Historic Centre of Zacatecas,1993,,-102,55556,22,76667,207,72,Cultural,C,Mexico,Latin America and the Caribbean,mx,mex830,702,Earliest 16th-Century Monasteries on the Slopes of Popocatepetl,1994,,-98,89778,18,93472,0,Cultural,C,Mexico,Latin America and the Caribbean,mx,mex845,714,Rock Paintings of the Sierra de San Francisco,1993,,-112,91611,27,65556,182600,Cultural,C,Mexico,Latin America and the Caribbean,mx,mex935,791,Pre-Hispanic Town of Uxmal,1996,,-89,77027778,20,36166667,0,Cultural,C,Mexico,Latin America and the Caribbean,mx,mex936,792,Historic Monuments Zone of Querétaro,1996,,-100,3666667,20,58333333,0,Cultural,C,Mexico,Latin America and the Caribbean,mx,mex963,815,Hospicio Cabañas, Guadalajara,1997,,-103,3397222,20,67388889,0,Cultural,C,Mexico,Latin America and the Caribbean,mx,mex1013,862,Historic Monuments Zone of Tlacotalpan,1998,,-95,65833333,18,60833333,75,Cultural,C,Mexico,Latin America and the Caribbean,mx,mex1046,895,Historic Fortified Town of Campeche,1999,,-90,53722,19,84639,181,Cultural,C,Mexico,Latin America and the Caribbean,mx,mex1094,939,Archaeological Monuments Zone of Xochicalco,1999,,-99,275,18,81028,707,65,Cultural,C,Mexico,Latin America and the Caribbean,mx,mex1963,1061,Ancient Maya City and Protected Tropical Forests of Calakmul, Campeche,2002,,-89,73728333,18,05302778,331397,Mixed,C/N,Mexico,Latin America and the Caribbean,mx,mex1256,1079,Franciscan Missions in the Sierra Gorda of Querétaro,2003,,-99,46411111,21,20438889,103,7,Cultural,C,Mexico,Latin America and the Caribbean,mx,mex1316,1136,Luis Barragán House and Studio,2004,,-99,19833333,19,41833333,0,1161,Cultural,C,Mexico,Latin America and the Caribbean,mx,mex1873,1182,Islands and Protected Areas of the Gulf of California,2005,,-112,54583,27,62667,688558,Natural,N,Mexico,Latin America and the Caribbean,mx,mex1386,1209,Agave Landscape and Ancient Industrial Facilities of Tequila,2006,,-103,7786111,20,86305556,35018,852,Cultural,C,Mexico,Latin America and the Caribbean,mx,mex1427,1250,Central University City Campus of the <i>Universidad Nacional Autónoma de México</i> (UNAM),2007,,-99,18805556,19,33222222,176,5,Cultural,C,Mexico,Latin America and the Caribbean,mx,mex1493,1274,Protective town of San Miguel and the Sanctuary of Jesús Nazareno de Atotonilco,2008,,-100,7463889,20,91444444,46,95,Cultural,C,Mexico,Latin America and the Caribbean,mx,mex1521,1290,Monarch Butterfly Biosphere Reserve,2008,,-100,2416667,19,60638889,13551,552,Natural,N,Mexico,Latin America and the Caribbean,mx,mex1691,1351,Camino Real de Tierra Adentro,2010,,-102,3791667,22,60805556,3101,91,Cultural,C,Mexico,Latin America and the Caribbean,mx,mex1693,1352,Prehistoric Caves of Yagul and Mitla in the Central Valley of Oaxaca,2010,,-96,42111111,16,95083333,1515,17,Cultural,C,Mexico,Latin America and the Caribbean,mx,mex1858,1410,El Pinacate and Gran Desierto de Altar Biosphere Reserve,2013,,-113,9166667,32,714566,Natural,N,Mexico,Latin America and the Caribbean,mx,mex2024,1463,Aqueduct of Padre Tembleque Hydraulic System,2015,,-98,66256667,19,83527778,6540,Cultural,C,Mexico,Latin America and the Caribbean,mx,mex1259,1081,Orkhon Valley Cultural Landscape,2004,,102,8313889,47,55666667,121967,Cultural,C,Mongolia,Asia and the Pacific,mn,mng1773,1382,Petroglyphic Complexes of the Mongolian Altai,2011,,88,39527778,49,33388889,11300,Cultural,C,Mongolia,Asia and the Pacific,mn,mng2018,1440,Great Burkhan Khaldun Mountain and its surrounding sacred landscape,2015,,109,0093278,48,76197778,443739,2,Cultural,C,Mongolia,Asia and the Pacific,mn,mng109,100,Durmitor National Park,1980,,19,0166,43,133,32100,Natural,N,Montenegro,Europe and North America,me,mne137,125,Natural and Culturo-Historical Region of Kotor,1979,P 1979-2003,18,7,42,48333,12000,Cultural,C,Montenegro,Europe and North America,me,mne188,170,Medina of Fez,1981,,-4,97778,34,06111,280,Cultural,C,Morocco,Arab States,ma,mar376,331,Medina of Marrakesh,1985,,-7,98667,31,63139,1107,Cultural,C,Morocco,Arab States,ma,mar515,444,Ksar of Ait-Ben-Haddou,1987,,-7,12889,31,04722,3,03,Cultural,C,Morocco,Arab States,ma,mar888,753,Medina of Essaouira (formerly Mogador),2001,,-9,76944,31,51667,30,Cultural,C,Morocco,Arab States,ma,mar937,793,Historic City of Meknes,1996,,-5,55833,33,88333,0,Cultural,C,Morocco,Arab States,ma,mar1625,836,Archaeological Site of Volubilis,1997,,-5,55694,34,07389,42,Cultural,C,Morocco,Arab States,ma,mar986,837,Medina of Tétouan (formerly known as Titawin),1997,,-5,36667,35,57083,6,5,Cultural,C,Morocco,Arab States,ma,mar1234,1058,Portuguese City of Mazagan (El Jadida),2004,,-8,50194,33,25667,7,5,Cultural,C,Morocco,Arab States,ma,mar1825,1401,Rabat, Modern Capital and Historic City: a Shared Heritage,2012,,-6,822777778,34,02416667,348,59,Cultural,C,Morocco,Arab States,ma,mar709,599,Island of Mozambique,1991,,40,73583,-15,03417,0,Cultural,C,Mozambique,Africa,mz,moz1987,1444,Pyu Ancient Cities,2014,,95,81861111,22,47,5809,Cultural,C,Myanmar,Asia and the Pacific,mm,mmr1432,1255,Twyfelfontein or /Ui-//aes,2007,,14,37258333,-20,59558333,57,4269,Cultural,C,Namibia,Africa,na,nam1915,1430,Namib Sand Sea,2013,,15,40777778,-24,88527778,3077700,Natural,N,Namibia,Africa,na,nam1448,121,Kathmandu Valley ,1979,P 2003-2007,85,30858,27,70395,167,37,Cultural,C,Nepal,Asia and the Pacific,np,npl318,284,Chitwan National Park,1984,,84,33333,27,5,93200,Natural,N,Nepal,Asia and the Pacific,np,npl788,666,Lumbini, the Birthplace of the Lord Buddha,1997,,83,27611,27,46889,1,95,Cultural,C,Nepal,Asia and the Pacific,np,npl967,819,Historic Area of Willemstad, Inner City and Harbour, Curaçao,1997,,-68,90222,12,10194,86,Cultural,C,Netherlands,Europe and North America,nl,nld1129,965,Rietveld Schröderhuis (Rietveld Schröder House),2000,,5,147222222,52,08527778,0,Cultural,C,Netherlands,Europe and North America,nl,nld1666,1349,Seventeenth-Century Canal Ring Area of Amsterdam inside the Singelgracht,2010,,4,887777778,52,365,198,2,Cultural,C,Netherlands,Europe and North America,nl,nld1984,1441,Van Nellefabriek,2014,,4,418333333,51,92333333,6,94,Cultural,C,Netherlands,Europe and North America,nl,nld1029,877,New Zealand Sub-Antarctic Islands,1998,,166,1044444,-50,75,76458,Natural,N,New Zealand,Asia and the Pacific,nz,nzl728,613,Ruins of León Viejo,2000,,-86,61028,12,39722,31,87,Cultural,C,Nicaragua,Latin America and the Caribbean,ni,nic1789,1236,León Cathedral,2011,,-86,87805556,12,435,0,77,Cultural,C,Nicaragua,Latin America and the Caribbean,ni,nic883,749,W National Park of Niger,1996,,2,35,12,35,220000,Natural,N,Niger,Africa,ne,ner1905,1268,Historic Centre of Agadez,2013,,7,991388889,16,97361111,77,6,Cultural,C,Niger,Africa,ne,ner1093,938,Sukur Cultural Landscape,1999,,13,57194,10,74056,0,Cultural,C,Nigeria,Africa,ng,nga1298,1118,Osun-Osogbo Sacred Grove,2005,,4,55222,7,75556,75,Cultural,C,Nigeria,Africa,ng,nga1667,55,Røros Mining Town and the Circumference,1980,,11,38555556,62,57388889,,Cultural,C,Norway,Europe and North America,no,nor62,58,Urnes Stave Church,1979,,7,33333,61,3,0,Cultural,C,Norway,Europe and North America,no,nor403,352,Rock Art of Alta,1985,,23,18333,69,95,0,Cultural,C,Norway,Europe and North America,no,nor1372,1195,West Norwegian Fjords – Geirangerfjord and Nærøyfjord,2005,,7,16667,62,11667,0,Natural,N,Norway,Europe and North America,no,nor2047,1486,Rjukan–Notodden Industrial Heritage Site,2015,,8,593611111,59,87861111,4959,5,Cultural,C,Norway,Europe and North America,no,nor502,433,Bahla Fort,1987,P 1988-2004,57,30111,22,96417,0,Cultural,C,Oman,Arab States,om,omn503,434,Archaeological Sites of Bat, Al-Khutm and Al-Ayn,1988,,56,745,23,26986,0,Cultural,C,Oman,Arab States,om,omn1180,1010,Land of Frankincense,2000,,53,64759,18,25333,849,88,Cultural,C,Oman,Arab States,om,omn1384,1207,<i>Aflaj</i> Irrigation Systems of Oman,2006,,57,53605556,22,99888889,1455,949,Cultural,C,Oman,Arab States,om,omn151,138,Archaeological Ruins at Moenjodaro,1980,,68,13888889,27,32916667,240,Cultural,C,Pakistan,Asia and the Pacific,pk,pak153,139,Taxila,1980,,72,8875,33,77916667,0,Cultural,C,Pakistan,Asia and the Pacific,pk,pak154,140,Buddhist Ruins of Takht-i-Bahi and Neighbouring City Remains at Sahr-i-Bahlol,1980,,71,94583333,34,32083333,0,Cultural,C,Pakistan,Asia and the Pacific,pk,pak158,143,Historical Monuments at Makli, Thatta,1981,,67,9,24,76666667,0,Cultural,C,Pakistan,Asia and the Pacific,pk,pak