unique_number,id_no,site_name_en,date_inscribed,danger_list,longitude,latitude,area_hectares,category,category_short,states_name_en,name_en,iso_code,udnp_code230,208,Cultural Landscape and Archaeological Remains of the Bamiyan Valley,2003,Y 2003,67,82525,34,84694,158,9265,Cultural,C,Afghanistan,Asia and the Pacific,af,afg234,211,Minaret and Archaeological Remains of Jam,2002,Y 2002,64,51605556,34,39655556,70,Cultural,C,Afghanistan,Asia and the Pacific,af,afg1590,569,Historic Centres of Berat and Gjirokastra ,2005,,20,13333333,40,06944444,58,9,Cultural,C,Albania,Europe and North America,al,alb1563,570,Butrint,1992,,20,02611111,39,75111111,,Cultural,C,Albania,Europe and North America,al,alb111,102,Al Qal'a of Beni Hammad,1980,,4,78684,35,81844,150,Cultural,C,Algeria,Arab States,dz,dza209,188,M'Zab Valley,1982,,3,68333,32,48333,665,03,Cultural,C,Algeria,Arab States,dz,dza212,191,Djémila,1982,,5,73667,36,32056,30,6,Cultural,C,Algeria,Arab States,dz,dza215,194,Timgad,1982,,6,63333,35,45,90,54,Cultural,C,Algeria,Arab States,dz,dza667,565,Kasbah of Algiers,1992,,3,06028,36,78333,60,Cultural,C,Algeria,Arab States,dz,dza1487,1160,Madriu-Perafita-Claror Valley,2004,,1,595555556,42,49472222,4247,Cultural,C,Andorra,Europe and North America,ad,and160,145,Los Glaciares National Park,1981,,-73,24944,-50,726927,Natural,N,Argentina,Latin America and the Caribbean,ar,arg340,303,Iguazu National Park,1984,,-54,13333333,-25,51805556,55000,Natural,N,Argentina,Latin America and the Caribbean,ar,arg1091,936,Cueva de las Manos, Río Pinturas,1999,,-70,66666667,-47,15,600,Cultural,C,Argentina,Latin America and the Caribbean,ar,arg1130,966,Ischigualasto / Talampaya Natural Parks,2000,,-68,-30,275369,Natural,N,Argentina,Latin America and the Caribbean,ar,arg1159,995,Jesuit Block and Estancias of Córdoba,2000,,-64,19111,-31,42056,38,12,Cultural,C,Argentina,Latin America and the Caribbean,ar,arg1295,1116,Quebrada de Humahuaca,2003,,-65,34886111,-23,19986111,172116,4375,Cultural,C,Argentina,Latin America and the Caribbean,ar,arg920,777,Monasteries of Haghpat and Sanahin,1996,,44,71028,41,095,2,65,Cultural,C,Armenia,Europe and North America,am,arm1124,960,Monastery of Geghard and the Upper Azat Valley,2000,,44,79667,40,15889,2,7,Cultural,C,Armenia,Europe and North America,am,arm1181,1011,Cathedral and Churches of Echmiatsin and the Archaeological Site of Zvartnots,2000,,44,29514,40,15931,74,3,Cultural,C,Armenia,Europe and North America,am,arm1872,147,Kakadu National Park,1981,,132,8333333,-12,83333333,1980994,92,Mixed,C/N,Australia,Asia and the Pacific,au,aus1457,166,Sydney Opera House,2007,0,151,2152778,-33,85666667,5,8,Cultural,C,Australia,Asia and the Pacific,au,aus185,167,Willandra Lakes Region,1981,,143,-34,240000,Mixed,C/N,Australia,Asia and the Pacific,au,aus206,186,Lord Howe Island Group,1982,,159,0883333,-31,56555556,146300,Natural,N,Australia,Asia and the Pacific,au,aus422,368,Gondwana Rainforests of Australia,1986,,150,05,-28,25,370000,Natural,N,Australia,Asia and the Pacific,au,aus519,447,Ulu<U>r</U>u-Kata Tju<U>t</U>a National Park,1987,,131,-25,33333333,132566,Mixed,C/N,Australia,Asia and the Pacific,au,aus684,578,Shark Bay, Western Australia,1991,,113,4361111,-25,48611111,2200902,Natural,N,Australia,Asia and the Pacific,au,aus748,630,Fraser Island,1992,,153,1333333,-25,21666667,184000,Natural,N,Australia,Asia and the Pacific,au,aus826,698,Australian Fossil Mammal Sites (Riversleigh / Naracoorte),1994,,138,7166667,-19,08333333,10300,Natural,N,Australia,Asia and the Pacific,au,aus1071,917,Greater Blue Mountains Area,2000,,150,-33,7,1032649,Natural,N,Australia,Asia and the Pacific,au,aus1272,1094,Purnululu National Park,2003,,128,5,-17,5,239723,Natural,N,Australia,Asia and the Pacific,au,aus1730,1131,Royal Exhibition Building and Carlton Gardens,2004,,144,9702778,-37,80611111,26,Cultural,C,Australia,Asia and the Pacific,au,aus1648,1306,Australian Convict Sites,2010,,150,9944444,-33,37833333,1502,51,Cultural,C,Australia,Asia and the Pacific,au,aus1763,1369,Ningaloo Coast,2011,,113,8102778,-22,5625,705015,Natural,N,Australia,Asia and the Pacific,au,aus927,784,Historic Centre of the City of Salzburg,1996,,13,04333333,47,80055556,236,Cultural,C,Austria,Europe and North America,at,aut928,785,Semmering Railway,1998,,15,82797222,47,64877778,156,18,Cultural,C,Austria,Europe and North America,at,aut929,786,Palace and Gardens of Schönbrunn,1996,,16,31333333,48,18666667,186,28,Cultural,C,Austria,Europe and North America,at,aut952,806,Hallstatt-Dachstein / Salzkammergut Cultural Landscape,1997,,13,64638889,47,55944444,28446,2,Cultural,C,Austria,Europe and North America,at,aut1724,931,City of Graz – Historic Centre and Schloss Eggenberg,1999,,15,39166667,47,07416667,,Cultural,C,Austria,Europe and North America,at,aut1134,970,Wachau Cultural Landscape,2000,,15,43416667,48,36444444,18387,Cultural,C,Austria,Europe and North America,at,aut1206,1033,Historic Centre of Vienna,2001,,16,38333333,48,21666667,371,Cultural,C,Austria,Europe and North America,at,aut1121,958,Walled City of Baku with the Shirvanshah's Palace and Maiden Tower,2000,P 2003-2009,49,83333333,40,36666667,21,5,Cultural,C,Azerbaijan,Europe and North America,az,aze1474,1076,Gobustan Rock Art Cultural Landscape,2007,,49,375,40,125,537,22,Cultural,C,Azerbaijan,Europe and North America,az,aze2062,1192,Qal’at al-Bahrain – Ancient Harbour and Capital of Dilmun,2005,,50,52722222,26,23306,70,4,Cultural,C,Bahrain,Arab States,bh,bhr1859,1364,Pearling, Testimony of an Island Economy,2012,,50,61351,26,24128,35086,81,Cultural,C,Bahrain,Arab States,bh,bhr365,321,Historic Mosque City of Bagerhat,1985,,89,8,22,66667,0,Cultural,C,Bangladesh,Asia and the Pacific,bd,bgd366,322,Ruins of the Buddhist Vihara at Paharpur,1985,,88,98333333,25,03333333,0,Cultural,C,Bangladesh,Asia and the Pacific,bd,bgd1786,1376,Historic Bridgetown and its Garrison,2011,,-59,61388889,13,09666667,187,Cultural,C,Barbados,Latin America and the Caribbean,bb,brb743,625,Mir Castle Complex,2000,,26,47272222,53,45108333,27,Cultural,C,Belarus,Europe and North America,by,blr1373,1196,Architectural, Residential and Cultural Complex of the Radziwill Family at Nesvizh,2005,,26,69139,53,22278,0,Cultural,C,Belarus,Europe and North America,by,blr1006,855,Flemish Béguinages,1998,,4,47375,51,03097222,59,95,Cultural,C,Belgium,Europe and North America,be,bel1007,856,The Four Lifts on the Canal du Centre and their Environs, La Louvière and Le Roeulx (Hainaut),1998,,4,13722,50,48111,67,3436,Cultural,C,Belgium,Europe and North America,be,bel1008,857,La Grand-Place, Brussels,1998,,4,35242,50,84668,1,48,Cultural,C,Belgium,Europe and North America,be,bel1160,996,Historic Centre of Brugge,2000,,3,22527,51,20891,410,Cultural,C,Belgium,Europe and North America,be,bel1173,1005,Major Town Houses of the Architect Victor Horta (Brussels),2000,,4,36223,50,82806,0,Cultural,C,Belgium,Europe and North America,be,bel1174,1006,Neolithic Flint Mines at Spiennes (Mons),2000,,3,97879,50,43077,172,Cultural,C,Belgium,Europe and North America,be,bel1179,1009,Notre-Dame Cathedral in Tournai,2000,,3,38926,50,60603,0,4963,Cultural,C,Belgium,Europe and North America,be,bel1362,1185,Plantin-Moretus House-Workshops-Museum Complex,2005,,4,39778,51,21833,0,23,Cultural,C,Belgium,Europe and North America,be,bel1578,1298,Stoclet House,2009,,4,416111111,50,835,0,86,Cultural,C,Belgium,Europe and North America,be,bel1837,1344,Major Mining Sites of Wallonia,2012,,3,838333333,50,43527778,118,07,Cultural,C,Belgium,Europe and North America,be,bel900,764,Belize Barrier Reef Reserve System,1996,1,-87,05833333,16,75,96300,Natural,N,Belize,Latin America and the Caribbean,bz,blz1560,323,Royal Palaces of Abomey,1985,,1,983333333,7,183333333,47,6,Cultural,C,Benin,Africa,bj,ben484,420,City of Potosí,1987,Y 2014,-65,75306,-19,58361,0,Cultural,C,Bolivia (Plurinational State of),Latin America and the Caribbean,bo,bol619,529,Jesuit Missions of the Chiquitos,1990,,-60,5,-16,0,Cultural,C,Bolivia (Plurinational State of),Latin America and the Caribbean,bo,bol668,566,Historic City of Sucre,1991,,-65,25917,-19,04306,0,Cultural,C,Bolivia (Plurinational State of),Latin America and the Caribbean,bo,bol670,567,Tiwanaku: Spiritual and Political Centre of the Tiwanaku Culture,2000,,-68,67778,-16,55833333,0,Cultural,C,Bolivia (Plurinational State of),Latin America and the Caribbean,bo,bol1035,883,Fuerte de Samaipata,1998,,-63,81666667,-18,16666667,0,Cultural,C,Bolivia (Plurinational State of),Latin America and the Caribbean,bo,bol1131,967,Noel Kempff Mercado National Park,2000,,-60,86667,-14,26667,1523446,Natural,N,Bolivia (Plurinational State of),Latin America and the Caribbean,bo,bol1107,946,Old Bridge Area of the Old City of Mostar,2005,,17,81092,43,34812,7,6,Cultural,C,Bosnia and Herzegovina,Europe and North America,ba,bih1437,1260,Mehmed Pa_a Sokolovi_ Bridge in Vi_egrad,2007,,19,288025,43,78144444,1,5,Cultural,C,Bosnia and Herzegovina,Europe and North America,ba,bih1191,1021,Tsodilo,2001,,21,73333333,-18,75,4800,Cultural,C,Botswana,Africa,bw,bwa1976,1432,Okavango Delta,2014,,22,9,-19,28333333,2023590,Natural,N,Botswana,Africa,bw,bwa136,124,Historic Town of Ouro Preto,1980,,-43,50555556,-20,38888889,0,Cultural,C,Brazil,Latin America and the Caribbean,br,bra210,189,Historic Centre of the Town of Olinda,1982,,-34,845,-8,013333333,120,Cultural,C,Brazil,Latin America and the Caribbean,br,bra348,309,Historic Centre of Salvador de Bahia,1985,,-38,5,-12,96666667,0,Cultural,C,Brazil,Latin America and the Caribbean,br,bra380,334,Sanctuary of Bom Jesus do Congonhas,1985,,-43,85777778,-20,49972222,2,19,Cultural,C,Brazil,Latin America and the Caribbean,br,bra408,355,Iguaçu National Park,1986,P 1999-2001,-54,43333,-25,68333,170086,Natural,N,Brazil,Latin America and the Caribbean,br,bra516,445,Brasilia,1987,,-47,9,-15,78333,11268,92,Cultural,C,Brazil,Latin America and the Caribbean,br,bra719,606,Serra da Capivara National Park,1991,,-42,33333333,-8,416666667,0,Cultural,C,Brazil,Latin America and the Caribbean,br,bra970,821,Historic Centre of São Luís,1997,,-44,3025,-2,514166667,66,65,Cultural,C,Brazil,Latin America and the Caribbean,br,bra1042,890,Historic Centre of the Town of Diamantina,1999,,-43,6,-18,23333333,28,5,Cultural,C,Brazil,Latin America and the Caribbean,br,bra1044,892,Discovery Coast Atlantic Forest Reserves,1999,,-39,25,-16,5,111930,Natural,N,Brazil,Latin America and the Caribbean,br,bra1045,893,Atlantic Forest South-East Reserves,1999,,-48,-24,16667,468193,Natural,N,Brazil,Latin America and the Caribbean,br,bra1157,993,Historic Centre of the Town of Goiás,2001,,-50,13336,-15,93328,40,3,Cultural,C,Brazil,Latin America and the Caribbean,br,bra1163,998,Central Amazon Conservation Complex,2000,,-62,00833333,-2,333333333,5323018,Natural,N,Brazil,Latin America and the Caribbean,br,bra1164,999,Pantanal Conservation Area,2000,,-57,38333,-17,71667,187818,Natural,N,Brazil,Latin America and the Caribbean,br,bra1166,1000,Brazilian Atlantic Islands: Fernando de Noronha and Atol das Rocas Reserves,2001,,-32,42511111,-3,857944444,42270,Natural,N,Brazil,Latin America and the Caribbean,br,bra1208,1035,Cerrado Protected Areas: Chapada dos Veadeiros and Emas National Parks,2001,,-47,68461111,-14,00569444,367356,Natural,N,Brazil,Latin America and the Caribbean,br,bra1843,1100,Rio de Janeiro: Carioca Landscapes between the Mountain and the Sea,2012,,-43,29138889,-22,94777778,7248,78,Cultural,C,Brazil,Latin America and the Caribbean,br,bra1725,1272,São Francisco Square in the Town of São Cristóvão,2010,,-37,21,-11,01611111,3,Cultural,C,Brazil,Latin America and the Caribbean,br,bra46,42,Boyana Church,1979,,23,26666667,42,65,0,68,Cultural,C,Bulgaria,Europe and North America,bg,bgr47,43,Madara Rider,1979,,27,15,43,3,1,2,Cultural,C,Bulgaria,Europe and North America,bg,bgr48,44,Thracian Tomb of Kazanlak,1979,,25,4,42,61666667,0,0155,Cultural,C,Bulgaria,Europe and North America,bg,bgr49,45,Rock-Hewn Churches of Ivanovo,1979,,25,96666667,43,71666667,171,9,Cultural,C,Bulgaria,Europe and North America,bg,bgr239,216,Rila Monastery,1983,,23,4,42,11666667,10,7,Cultural,C,Bulgaria,Europe and North America,bg,bgr240,217,Ancient City of Nessebar,1983,,27,73,42,65611,27,1,Cultural,C,Bulgaria,Europe and North America,bg,bgr1621,219,Srebarna Nature Reserve,1983,P 1992-2003,27,07806,44,11444,638,Natural,N,Bulgaria,Europe and North America,bg,bgr1641,225,Pirin National Park,1983,,23,43047222,41,74272222,38350,04,Natural,N,Bulgaria,Europe and North America,bg,bgr412,359,Thracian Tomb of Sveshtari,1985,,26,66667,43,66667,647,6,Cultural,C,Bulgaria,Europe and North America,bg,bgr1696,1225,Ruins of Loropéni,2009,,-3,583333333,10,25,1,113,Cultural,C,Burkina Faso,Africa,bf,bfa1600,1310,Cidade Velha, Historic Centre of Ribeira Grande,2009,,-23,60519444,14,91513889,209,1,Cultural,C,Cabo Verde,Africa,cv,cpv791,668,Angkor,1992,P 1992-2004,103,8333333,13,43333333,40100,Cultural,C,Cambodia,Asia and the Pacific,kh,khm1591,1224,Temple of Preah Vihear,2008,,104,6838889,14,38833333,154,7,Cultural,C,Cambodia,Asia and the Pacific,kh,khm470,407,Dja Faunal Reserve,1987,,13,3,526000,Natural,N,Cameroon,Africa,cm,cmr7,4,L’Anse aux Meadows National Historic Site,1978,,-55,61666667,51,46666667,8056,Cultural,C,Canada,Europe and North America,ca,can27,24,Nahanni National Park,1978,,-125,5894444,61,54722222,476560,Natural,N,Canada,Europe and North America,ca,can75,71,Dinosaur Provincial Park,1979,,-111,4922222,50,76777778,7493,Natural,N,Canada,Europe and North America,ca,can175,157,S<U>G</U>ang Gwaay,1981,,-131,2202778,52,095,0,Cultural,C,Canada,Europe and North America,ca,can176,158,Head-Smashed-In Buffalo Jump,1981,,-113,6238889,49,74944444,4000,Cultural,C,Canada,Europe and North America,ca,can286,256,Wood Buffalo National Park,1983,,-112,2933333,59,35833333,4480000,Natural,N,Canada,Europe and North America,ca,can336,300,Historic District of Old Québec,1985,,-71,21055556,46,80944444,135,Cultural,C,Canada,Europe and North America,ca,can483,419,Gros Morne National Park,1987,,-57,53138889,49,6125,180500,Natural,N,Canada,Europe and North America,ca,can812,686,Miguasha National Park,1999,,-66,35305556,48,105,87,Natural,N,Canada,Europe and North America,ca,can875,741,Old Town Lunenburg,1995,,-64,30916667,44,37611111,33,47,Cultural,C,Canada,Europe and North America,ca,can1475,1221,Rideau Canal,2007,,-75,765125,44,99438611,21454,81,Cultural,C,Canada,Europe and North America,ca,can1516,1285,Joggins Fossil Cliffs,2008,,-64,43583333,45,70972222,689,Natural,N,Canada,Europe and North America,ca,can1828,1404,Landscape of Grand Pré,2012,,-64,30722222,45,11833333,1323,24,Cultural,C,Canada,Europe and North America,ca,can1874,1412,Red Bay Basque Whaling Station,2013,,-56,42952222,51,726925,312,973,Cultural,C,Canada,Europe and North America,ca,can553,475,Manovo-Gounda St Floris National Park,1988,Y 1997,21,5,9,1740000,Natural,N,Central African Republic,Africa,cf,caf1824,1400,Lakes of Ounianga,2012,,20,50555556,19,055,62808,Natural,N,Chad,Africa,td,tcd846,715,Rapa Nui National Park,1995,,-109,45,-27,15,6666,Cultural,C,Chile,Latin America and the Caribbean,cl,chl1123,959,Historic Quarter of the Seaport City of Valparaíso,2003,,-71,628,-33,04063889,23,2,Cultural,C,Chile,Latin America and the Caribbean,cl,chl1135,971,Churches of Chiloé,2000,,-73,76666667,-42,5,0,Cultural,C,Chile,Latin America and the Caribbean,cl,chl1869,1178,Humberstone and Santa Laura Saltpeter Works,2005,,-69,79406,-20,20582,573,48,Cultural,C,Chile,Latin America and the Caribbean,cl,chl1391,1214,Sewell Mining Town,2006,,-70,38277778,-34,08444444,17,2,Cultural,C,Chile,Latin America and the Caribbean,cl,chl507,437,Mount Taishan,1987,,117,1,36,26667,25000,Mixed,C/N,China,Asia and the Pacific,cn,chn508,438,The Great Wall,1987,,116,08333,40,41667,2151,55,Cultural,C,China,Asia and the Pacific,cn,chn510,439,Imperial Palaces of the Ming and Qing Dynasties in Beijing and Shenyang,1987,,123,4469444,41,79416667,12,96,Cultural,C,China,Asia and the Pacific,cn,chn511,440,Mogao Caves,1987,,94,81667,40,13333,0,Cultural,C,China,Asia and the Pacific,cn,chn512,441,Mausoleum of the First Qin Emperor,1987,,109,1,34,38333333,0,Cultural,C,China,Asia and the Pacific,cn,chn521,449,Peking Man Site at Zhoukoudian,1987,,115,9166667,39,73333333,480,Cultural,C,China,Asia and the Pacific,cn,chn1933,547,Mount Huangshan,1990,,118,18333,30,16667,16060,Mixed,C/N,China,Asia and the Pacific,cn,chn757,637,Jiuzhaigou Valley Scenic and Historic Interest Area,1992,,103,91667,33,08333,72000,Natural,N,China,Asia and the Pacific,cn,chn758,638,Huanglong Scenic and Historic Interest Area,1992,,103,82222,32,75417,60000,Natural,N,China,Asia and the Pacific,cn,chn760,640,Wulingyuan Scenic and Historic Interest Area,1992,,110,5,29,33333,26400,Natural,N,China,Asia and the Pacific,cn,chn831,703,Mountain Resort and its Outlying Temples, Chengde,1994,,117,93833,40,98694,0,Cultural,C,China,Asia and the Pacific,cn,chn832,704,Temple and Cemetery of Confucius and the Kong Family Mansion in Qufu,1994,,116,975,35,61167,0,Cultural,C,China,Asia and the Pacific,cn,chn833,705,Ancient Building Complex in the Wudang Mountains,1994,,111,32,46667,0,Cultural,C,China,Asia and the Pacific,cn,chn837,707,Historic Ensemble of the Potala Palace, Lhasa,1994,,91,11717,29,65792,60,5,Cultural,C,China,Asia and the Pacific,cn,chn921,778,Lushan National Park,1996,,115,8666667,29,43333333,0,Cultural,C,China,Asia and the Pacific,cn,chn922,779,Mount Emei Scenic Area, including Leshan Giant Buddha Scenic Area,1996,,103,76925,29,5449,15400,Mixed,C/N,China,Asia and the Pacific,cn,chn1934,811,Old Town of Lijiang,1997,,100,23333,26,86667,145,6,Cultural,C,China,Asia and the Pacific,cn,chn959,812,Ancient City of Ping Yao,1997,,112,15444,37,20139,245,62,Cultural,C,China,Asia and the Pacific,cn,chn961,813,Classical Gardens of Suzhou,1997,,120,45,31,31666667,11,922,Cultural,C,China,Asia and the Pacific,cn,chn1032,880,Summer Palace, an Imperial Garden in Beijing,1998,,116,1411111,39,91055556,297,Cultural,C,China,Asia and the Pacific,cn,chn1033,881,Temple of Heaven: an Imperial Sacrificial Altar in Beijing,1998,,116,4447222,39,84555556,215,Cultural,C,China,Asia and the Pacific,cn,chn1064,911,Mount Wuyi,1999,,117,68333,27,71667,99975,Mixed,C/N,China,Asia and the Pacific,cn,chn1065,912,Dazu Rock Carvings,1999,,105,705,29,70111,20,41,Cultural,C,China,Asia and the Pacific,cn,chn1167,1001,Mount Qingcheng and the Dujiangyan Irrigation System,2000,,103,60528,31,00167,0,Cultural,C,China,Asia and the Pacific,cn,chn1168,1002,Ancient Villages in Southern Anhui – Xidi and Hongcun,2000,,117,9875,29,90444444,52,Cultural,C,China,Asia and the Pacific,cn,chn1169,1003,Longmen Grottoes,2000,,112,4666667,34,46666667,331,Cultural,C,China,Asia and the Pacific,cn,chn1172,1004,Imperial Tombs of the Ming and Qing Dynasties,2000,,124,7938889,41,70722222,3434,9399,Cultural,C,China,Asia and the Pacific,cn,chn1213,1039,Yungang Grottoes,2001,,113,12222,40,10972,348,75,Cultural,C,China,Asia and the Pacific,cn,chn1731,1083,Three Parallel Rivers of Yunnan Protected Areas,2003,,98,40638889,27,895,,Natural,N,China,Asia and the Pacific,cn,chn1289,1110,Historic Centre of Macao,2005,,113,5364611,22,19129194,16,1678,Cultural,C,China,Asia and the Pacific,cn,chn1877,1111,Cultural Landscape of Honghe Hani Rice Terraces ,2013,,102,7799806,23,09327778,16603,22,Cultural,C,China,Asia and the Pacific,cn,chn1459,1112,Kaiping Diaolou and Villages,2007,,112,5658611,22,28551944,371,948,Cultural,C,China,Asia and the Pacific,cn,chn1505,1113,Fujian <em>Tulou</em>,2008,,117,6858333,25,02305556,152,65,Cultural,C,China,Asia and the Pacific,cn,chn1293,1114,Yin Xu,2006,,114,3138889,36,12666667,414,Cultural,C,China,Asia and the Pacific,cn,chn1315,1135,Capital Cities and Tombs of the Ancient Koguryo Kingdom,2004,,126,1872222,41,15694444,4164,8599,Cultural,C,China,Asia and the Pacific,cn,chn1390,1213,Sichuan Giant Panda Sanctuaries - Wolong, Mt Siguniang and Jiajin Mountains ,2006,,103,30,83333333,924500,Natural,N,China,Asia and the Pacific,cn,chn1965,1248,South China Karst,2007,,110,3544444,24,92333333,49537,Natural,N,China,Asia and the Pacific,cn,chn1587,1279,Mount Wutai,2009,,113,5633333,39,03055556,18415,Cultural,C,China,Asia and the Pacific,cn,chn1523,1292,Mount Sanqingshan National Park,2008,,118,0644444,28,91583333,22950,Natural,N,China,Asia and the Pacific,cn,chn1726,1305,Historic Monuments of Dengfeng in “The Centre of Heaven and Earth”,2010,,113,0677194,34,45874722,825,Cultural,C,China,Asia and the Pacific,cn,chn1765,1334,West Lake Cultural Landscape of Hangzhou,2011,,120,1408333,30,2375,3322,88,Cultural,C,China,Asia and the Pacific,cn,chn1676,1335,China Danxia,2010,,106,0425,28,42194444,82151,Natural,N,China,Asia and the Pacific,cn,chn1803,1388,Chengjiang Fossil Site,2012,,102,9772222,24,66888889,512,Natural,N,China,Asia and the Pacific,cn,chn1804,1389,Site of Xanadu,2012,,116,1851278,42,358,25131,27,Cultural,C,China,Asia and the Pacific,cn,chn1876,1414,Xinjiang Tianshan,2013,,80,35416667,41,96833333,606833,Natural,N,China,Asia and the Pacific,cn,chn1986,1443,The Grand Canal,2014,,112,4683333,34,69388889,20819,11,Cultural,C,China,Asia and the Pacific,cn,chn2035,1474,Tusi Sites,2015,,109,9669444,28,99861111,781,28,Cultural,C,China,Asia and the Pacific,cn,chn319,285,Port, Fortresses and Group of Monuments, Cartagena,1984,,-75,53333333,10,41666667,0,Cultural,C,Colombia,Latin America and the Caribbean,co,col841,711,Los Katíos National Park,1994,1,-77,7,666666667,72000,Natural,N,Colombia,Latin America and the Caribbean,co,col876,742,Historic Centre of Santa Cruz de Mompox,1995,,-74,43333333,9,233333333,0,Cultural,C,Colombia,Latin America and the Caribbean,co,col877,743,National Archeological Park of Tierradentro,1995,,-76,03333333,2,583333333,0,Cultural,C,Colombia,Latin America and the Caribbean,co,col878,744,San Agustín Archaeological Park,1995,,-76,23333333,1,916666667,0,Cultural,C,Colombia,Latin America and the Caribbean,co,col1787,1121,Coffee Cultural Landscape of Colombia,2011,,-75,68166667,5,471666667,141120,Cultural,C,Colombia,Latin America and the Caribbean,co,col1393,1216,Malpelo Fauna and Flora Sanctuary,2006,,-81,61666667,3,966666667,857500,Natural,N,Colombia,Latin America and the Caribbean,co,col969,820,Cocos Island National Park,1997,,-87,06666667,5,533333333,199790,Natural,N,Costa Rica,Latin America and the Caribbean,cr,cri1997,1453,Precolumbian Chiefdom Settlements with Stone Spheres of the Diquís,2014,,-83,4775,8,911388889,24,73,Cultural,C,Costa Rica,Latin America and the Caribbean,cr,cri1919,1322,Historic Town of Grand-Bassam,2012,,3,736388889,5,195833333,109,89,Cultural,C,Côte d'Ivoire,Africa,ci,civ103,95,Old City of Dubrovnik,1979,P 1991-1998,18,09139,42,65056,96,7,Cultural,C,Croatia,Europe and North America,hr,hrv105,97,Historical Complex of Split with the Palace of Diocletian,1979,,16,44333,43,50944,20,8,Cultural,C,Croatia,Europe and North America,hr,hrv106,98,Plitvice Lakes National Park,1979,P 1992-1997,15,61444,44,87778,29482,Natural,N,Croatia,Europe and North America,hr,hrv956,809,Episcopal Complex of the Euphrasian Basilica in the Historic Centre of Pore_,1997,,13,59444,45,22917,1,1,Cultural,C,Croatia,Europe and North America,hr,hrv957,810,Historic City of Trogir,1997,,16,25167,43,5125,6,4,Cultural,C,Croatia,Europe and North America,hr,hrv1127,963,The Cathedral of St James in _ibenik,2000,,15,89038,43,73629,0,1,Cultural,C,Croatia,Europe and North America,hr,hrv1484,1240,Stari Grad Plain,2008,,16,63861111,43,18166667,1376,53,Cultural,C,Croatia,Europe and North America,hr,hrv991,840,Viñales Valley,1999,,-83,71667,22,61667,0,Cultural,C,Cuba,Latin America and the Caribbean,cu,cub992,841,San Pedro de la Roca Castle, Santiago de Cuba,1997,,-75,87083333,19,96666667,93,88,Cultural,C,Cuba,Latin America and the Caribbean,cu,cub1041,889,Desembarco del Granma National Park,1999,,-77,63333,19,88333,41863,Natural,N,Cuba,Latin America and the Caribbean,cu,cub1379,1202,Urban Historic Centre of Cienfuegos ,2005,,-80,45278,22,14722,70,Cultural,C,Cuba,Latin America and the Caribbean,cu,cub1482,1270,Historic Centre of Camagüey,2008,,-77,91861111,21,37861111,54,Cultural,C,Cuba,Latin America and the Caribbean,cu,cub85,79,Paphos,1980,,32,40556,34,75833,0,Cultural,C,Cyprus,Europe and North America,cy,cyp1927,848,Choirokoitia,1998,,33,34333,34,79833,6,2,Cultural,C,Cyprus,Europe and North America,cy,cyp1928,616,Historic Centre of Prague,1992,,14,41944,50,08972,1106,36,Cultural,C,Czech Republic,Europe and North America,cz,cze732,617,Historic Centre of _esk_ Krumlov,1992,,14,31666667,48,81666667,51,91,Cultural,C,Czech Republic,Europe and North America,cz,cze738,621,Historic Centre of Tel_,1992,,15,45,49,18333,36,Cultural,C,Czech Republic,Europe and North America,cz,cze816,690,Pilgrimage Church of St John of Nepomuk at Zelená Hora,1994,,15,94205833,49,5802,0,64,Cultural,C,Czech Republic,Europe and North America,cz,cze865,732,Kutná Hora: Historical Town Centre with the Church of St Barbara and the Cathedral of Our Lady at Sedlec,1995,,15,26666667,49,95,62,437,Cultural,C,Czech Republic,Europe and North America,cz,cze899,763,Lednice-Valtice Cultural Landscape,1996,,16,775,48,77583,14320,Cultural,C,Czech Republic,Europe and North America,cz,cze1010,859,Holy Trinity Column in Olomouc,2000,,17,25045833,49,59393611,0,0227,Cultural,C,Czech Republic,Europe and North America,cz,cze1011,860,Gardens and Castle at Krom__í_,1998,,17,37722222,49,3,74,5,Cultural,C,Czech Republic,Europe and North America,cz,cze1012,861,Hola_ovice Historic Village,1998,,14,25277778,48,95972222,11,4,Cultural,C,Czech Republic,Europe and North America,cz,cze1054,901,Litomy_l Castle,1999,,16,31444,49,87361,4,4,Cultural,C,Czech Republic,Europe and North America,cz,cze