unique_number,id_no,site_name_en,date_inscribed,danger_list,longitude,latitude,area_hectares,category,category_short,states_name_en,name_en,iso_code,udnp_code1744,36,Medina of Tunis,1979,,10,16667,36,81667,296,41,Cultural,C,Tunisia,Arab States,tn,tun41,37,Archaeological Site of Carthage,1979,,10,32333,36,85278,616,02,Cultural,C,Tunisia,Arab States,tn,tun1741,38,Amphitheatre of El Jem,1979,,10,70694,35,29639,1,37,Cultural,C,Tunisia,Arab States,tn,tun378,332,Punic Town of Kerkuane and its Necropolis,1985,,11,09917,36,94639,0,Cultural,C,Tunisia,Arab States,tn,tun1743,498,Medina of Sousse,1988,,10,63861,35,82778,31,68,Cultural,C,Tunisia,Arab States,tn,tun1742,499,Kairouan,1988,,10,10389,35,68167,68,02,Cultural,C,Tunisia,Arab States,tn,tun938,794,Dougga / Thugga,1997,,9,22028,36,42361,70,Cultural,C,Tunisia,Arab States,tn,tun409,356,Historic Areas of Istanbul,1985,,28,97993,41,00847,678,Cultural,C,Turkey,Europe and North America,tr,tur410,357,Göreme National Park and the Rock Sites of Cappadocia,1985,,34,85,38,66667,9883,81,Mixed,C/N,Turkey,Europe and North America,tr,tur411,358,Great Mosque and Hospital of Divri_i,1985,,38,121826,39,371271,2016,Cultural,C,Turkey,Europe and North America,tr,tur432,377,Hattusha: the Hittite Capital,1986,,34,62056,40,01389,268,46,Cultural,C,Turkey,Europe and North America,tr,tur520,448,Nemrut Da_,1987,,38,76369,38,03661,11,Cultural,C,Turkey,Europe and North America,tr,tur563,484,Xanthos-Letoon,1988,,29,32028,36,335,126,4,Cultural,C,Turkey,Europe and North America,tr,tur564,485,Hierapolis-Pamukkale,1988,,29,12333,37,92389,1077,Mixed,C/N,Turkey,Europe and North America,tr,tur729,614,City of Safranbolu,1994,,32,68972,41,26,193,Cultural,C,Turkey,Europe and North America,tr,tur1000,849,Archaeological Site of Troy,1998,,26,239,39,95644,158,Cultural,C,Turkey,Europe and North America,tr,tur2014,1018,Ephesus,2015,,27,35944444,37,92916667,662,62,Cultural,C,Turkey,Europe and North America,tr,tur1784,1366,Selimiye Mosque and its Social Complex,2011,,26,55944444,41,67777778,2,5,Cultural,C,Turkey,Europe and North America,tr,tur1829,1405,Neolithic Site of Çatalhöyük,2012,,32,82805556,37,66666667,37,Cultural,C,Turkey,Europe and North America,tr,tur1995,1452,Bursa and Cumalıkızık: the Birth of the Ottoman Empire,2014,,29,06233611,40,18473056,27,467,Cultural,C,Turkey,Europe and North America,tr,tur2001,1457,Pergamon and its Multi-Layered Cultural Landscape,2014,,27,18,39,12583333,332,5,Cultural,C,Turkey,Europe and North America,tr,tur2049,1488,Diyarbakır Fortress and Hevsel Gardens Cultural Landscape,2015,,40,23930833,37,9031,521,23,Cultural,C,Turkey,Europe and North America,tr,tur1038,886,State Historical and Cultural Park “Ancient Merv”,1999,,62,1775,37,70083,353,24,Cultural,C,Turkmenistan,Asia and the Pacific,tm,tkm1376,1199,Kunya-Urgench,2005,,59,08494,42,18318,0,Cultural,C,Turkmenistan,Asia and the Pacific,tm,tkm1471,1242,Parthian Fortresses of Nisa,2007,,58,19861111,37,99972222,77,905,Cultural,C,Turkmenistan,Asia and the Pacific,tm,tkm806,682,Bwindi Impenetrable National Park,1994,,29,66138889,-1,080555556,32092,Natural,N,Uganda,Africa,ug,uga808,684,Rwenzori Mountains National Park,1994,P 1999-2004,29,92416667,0,223611111,99600,Natural,N,Uganda,Africa,ug,uga1192,1022,Tombs of Buganda Kings at Kasubi,2001,Y 2010,32,55138889,0,348611111,26,8,Cultural,C,Uganda,Africa,ug,uga617,527,Kiev: Saint-Sophia Cathedral and Related Monastic Buildings, Kiev-Pechersk Lavra,1990,,30,51686,50,45258,28,52,Cultural,C,Ukraine,Europe and North America,ua,ukr1632,865,L'viv – the Ensemble of the Historic Centre,1998,,24,03198,49,84163,120,Cultural,C,Ukraine,Europe and North America,ua,ukr1785,1330,Residence of Bukovinian and Dalmatian Metropolitans,2011,,25,92472222,48,29666667,8,Cultural,C,Ukraine,Europe and North America,ua,ukr1895,1411,Ancient City of Tauric Chersonese and its Chora,2013,,33,49138889,44,61083333,259,3752,Cultural,C,Ukraine,Europe and North America,ua,ukr1762,1343,Cultural Sites of Al Ain (Hafit, Hili, Bidaa Bint Saud and Oases Areas),2011,,55,80638889,24,06777778,4945,45,Cultural,C,United Arab Emirates,Arab States,ae,are423,369,Giant's Causeway and Causeway Coast,1986,,-6,485277778,55,25,70,Natural,N,United Kingdom of Great Britain and Northern Ireland,Europe and North America,gb,gbr1634,370,Durham Castle and Cathedral,1986,,-1,576111111,54,77472222,8,79,Cultural,C,United Kingdom of Great Britain and Northern Ireland,Europe and North America,gb,gbr425,371,Ironbridge Gorge,1986,,-2,472777778,52,62638889,0,Cultural,C,United Kingdom of Great Britain and Northern Ireland,Europe and North America,gb,gbr1930,372,Studley Royal Park including the Ruins of Fountains Abbey,1986,,-1,573055556,54,11611111,309,Cultural,C,United Kingdom of Great Britain and Northern Ireland,Europe and North America,gb,gbr1633,373,Stonehenge, Avebury and Associated Sites,1986,,-1,825277778,51,17888889,4985,4,Cultural,C,United Kingdom of Great Britain and Northern Ireland,Europe and North America,gb,gbr429,374,Castles and Town Walls of King Edward in Gwynedd,1986,,-4,276944444,53,13972222,6,Cultural,C,United Kingdom of Great Britain and Northern Ireland,Europe and North America,gb,gbr447,387,St Kilda,1986,,-8,576666667,57,81722222,24201,4004,Mixed,C/N,United Kingdom of Great Britain and Northern Ireland,Europe and North America,gb,gbr492,425,Blenheim Palace,1987,,-1,361388889,51,84194444,0,Cultural,C,United Kingdom of Great Britain and Northern Ireland,Europe and North America,gb,gbr1635,426,Palace of Westminster and Westminster Abbey including Saint Margaret’s Church,1987,,-0,128611111,51,49972222,10,26,Cultural,C,United Kingdom of Great Britain and Northern Ireland,Europe and North America,gb,gbr497,429,New Lanark,2001,,-3,783055556,55,66333333,146,Cultural,C,United Kingdom of Great Britain and Northern Ireland,Europe and North America,gb,gbr566,487,Henderson Island,1988,,-128,3333333,-24,36666667,3700,Natural,N,United Kingdom of Great Britain and Northern Ireland,Europe and North America,gb,gbr567,488,Tower of London,1988,,-0,076111111,51,50805556,0,Cultural,C,United Kingdom of Great Britain and Northern Ireland,Europe and North America,gb,gbr578,496,Canterbury Cathedral, St Augustine's Abbey, and St Martin's Church,1988,,1,083333333,51,28,18,17,Cultural,C,United Kingdom of Great Britain and Northern Ireland,Europe and North America,gb,gbr599,514,Heart of Neolithic Orkney,1999,,-3,188666667,58,99605556,15,3,Cultural,C,United Kingdom of Great Britain and Northern Ireland,Europe and North America,gb,gbr860,728,Old and New Towns of Edinburgh,1995,,-3,216666667,55,95,0,Cultural,C,United Kingdom of Great Britain and Northern Ireland,Europe and North America,gb,gbr874,740,Gough and Inaccessible Islands,1995,,-9,928611111,-40,32472222,7900,Natural,N,United Kingdom of Great Britain and Northern Ireland,Europe and North America,gb,gbr939,795,Maritime Greenwich,1997,,0,51,47777778,109,5,Cultural,C,United Kingdom of Great Britain and Northern Ireland,Europe and North America,gb,gbr1147,983,Historic Town of St George and Related Fortifications, Bermuda,2000,,-64,67777778,32,37944444,257,5,Cultural,C,United Kingdom of Great Britain and Northern Ireland,Europe and North America,gb,gbr1148,984,Blaenavon Industrial Landscape,2000,,-3,088055556,51,77638889,3290,Cultural,C,United Kingdom of Great Britain and Northern Ireland,Europe and North America,gb,gbr1201,1028,Saltaire,2001,,-1,788333333,53,83916667,20,Cultural,C,United Kingdom of Great Britain and Northern Ireland,Europe and North America,gb,gbr1203,1030,Derwent Valley Mills,2001,,-1,488055556,53,02888889,1228,7,Cultural,C,United Kingdom of Great Britain and Northern Ireland,Europe and North America,gb,gbr1262,1084,Royal Botanic Gardens, Kew,2003,,-0,294027778,51,48194444,132,Cultural,C,United Kingdom of Great Britain and Northern Ireland,Europe and North America,gb,gbr1331,1150,Liverpool – Maritime Mercantile City,2004,Y 2012,-2,994444444,53,40666667,136,Cultural,C,United Kingdom of Great Britain and Northern Ireland,Europe and North America,gb,gbr1392,1215,Cornwall and West Devon Mining Landscape,2006,0,-5,383611111,50,13611111,19719,Cultural,C,United Kingdom of Great Britain and Northern Ireland,Europe and North America,gb,gbr1583,1303,Pontcysyllte Aqueduct and Canal,2009,,-3,087777778,52,97027778,105,Cultural,C,United Kingdom of Great Britain and Northern Ireland,Europe and North America,gb,gbr2046,1485,The Forth Bridge,2015,,-3,388888889,56,00111111,7,5,Cultural,C,United Kingdom of Great Britain and Northern Ireland,Europe and North America,gb,gbr1639,39,Ngorongoro Conservation Area,1979,P 1984-1989,35,54083,-3,18722,809440,Mixed,C/N,United Republic of Tanzania,Africa,tz,tza159,144,Ruins of Kilwa Kisiwani and Ruins of Songo Mnara,1981,P 2004-2014,39,52278,-8,95778,0,Cultural,C,United Republic of Tanzania,Africa,tz,tza174,156,Serengeti National Park,1981,,34,56667,-2,33333,1476300,Natural,N,United Republic of Tanzania,Africa,tz,tza192,173,Stone Town of Zanzibar,2000,,39,18917,-6,16306,96,Cultural,C,United Republic of Tanzania,Africa,tz,tza1924,199,Selous Game Reserve,1982,,37,4,-9,5120000,Natural,N,United Republic of Tanzania,Africa,tz,tza466,403,Kilimanjaro National Park,1987,,37,36667,-3,06667,75575,Natural,N,United Republic of Tanzania,Africa,tz,tza1449,1183,Kondoa Rock-Art Sites,2006,,35,83388889,-4,724444444,233600,Cultural,C,United Republic of Tanzania,Africa,tz,tza30,27,Mesa Verde National Park,1978,,-108,4855556,37,26166667,21043,Cultural,C,United States of America,Europe and North America,us,usa31,28,Yellowstone National Park,1978,P 1995-2003,-110,82778,44,46056,898349,Natural,N,United States of America,Europe and North America,us,usa81,75,Grand Canyon National Park,1979,,-112,0905556,36,10083333,493270,Natural,N,United States of America,Europe and North America,us,usa82,76,Everglades National Park,1979,Y 2010 P 1993-2007,-80,99638889,25,55444444,567017,Natural,N,United States of America,Europe and North America,us,usa84,78,Independence Hall,1979,,-75,15,39,94861111,2,Cultural,C,United States of America,Europe and North America,us,usa147,134,Redwood National and State Parks,1980,,-123,9980556,41,37388889,56883,Natural,N,United States of America,Europe and North America,us,usa168,150,Mammoth Cave National Park,1981,,-86,10305556,37,18722222,21191,Natural,N,United States of America,Europe and North America,us,usa169,151,Olympic National Park,1981,,-123,4488889,47,74833333,,Natural,N,United States of America,Europe and North America,us,usa219,198,Cahokia Mounds State Historic Site,1982,,-90,06138889,38,65861111,591,Cultural,C,United States of America,Europe and North America,us,usa289,259,Great Smoky Mountains National Park,1983,,-83,43555556,35,59305556,209000,Natural,N,United States of America,Europe and North America,us,usa296,266,La Fortaleza and San Juan National Historic Site in Puerto Rico,1983,,-66,125,18,46666667,0,Cultural,C,United States of America,Europe and North America,us,usa346,307,Statue of Liberty,1984,,-74,04472222,40,68944444,5,Cultural,C,United States of America,Europe and North America,us,usa347,308,Yosemite National Park,1984,,-119,5966667,37,74611111,308283,Natural,N,United States of America,Europe and North America,us,usa405,353,Chaco Culture,1987,,-107,9708333,36,06377778,0,Cultural,C,United States of America,Europe and North America,us,usa472,409,Hawaii Volcanoes National Park,1987,,-155,1236111,19,40083333,87940,Natural,N,United States of America,Europe and North America,us,usa513,442,Monticello and the University of Virginia in Charlottesville,1987,,-78,50388889,38,03277778,0,Cultural,C,United States of America,Europe and North America,us,usa573,492,Taos Pueblo,1992,,-105,54167,36,43889,19,01,Cultural,C,United States of America,Europe and North America,us,usa852,721,Carlsbad Caverns National Park,1995,,-104,3833333,32,16666667,18926,Natural,N,United States of America,Europe and North America,us,usa1672,1326,Papah_naumoku_kea,2010,,-170,14582,25,34907,36207499,Mixed,C/N,United States of America,Europe and North America,us,usa1978,1435,Monumental Earthworks of Poverty Point,2014,,-91,40638889,32,63694444,163,Cultural,C,United States of America,Europe and North America,us,usa2027,1466,San Antonio Missions,2015,,-98,46,29,32805556,300,8,Cultural,C,United States of America,Europe and North America,us,usa881,747,Historic Quarter of the City of Colonia del Sacramento,1995,,-57,85333333,-34,46777778,16,Cultural,C,Uruguay,Latin America and the Caribbean,uy,ury2025,1464,Fray Bentos Cultural-Industrial Landscape,2015,,-58,33166667,-33,11777778,273,8,Cultural,C,Uruguay,Latin America and the Caribbean,uy,ury638,543,Itchan Kala,1990,,60,36389,41,37833,37,5,Cultural,C,Uzbekistan,Asia and the Pacific,uz,uzb713,602,Historic Centre of Bukhara,1993,,64,42861,39,77472,200,Cultural,C,Uzbekistan,Asia and the Pacific,uz,uzb715,603,Samarkand  – Crossroad of Cultures,2001,,67,39,66861,1123,Cultural,C,Uzbekistan,Asia and the Pacific,uz,uzb1037,885,Historic Centre of Shakhrisyabz,2000,,66,83333,39,05,240,Cultural,C,Uzbekistan,Asia and the Pacific,uz,uzb1511,1280,Chief Roi Mata’s Domain,2008,,168,1777194,-17,62806944,886,31,Cultural,C,Vanuatu,Asia and the Pacific,vu,vut779,658,Coro and its Port,1993,Y 2005,-69,68333333,11,4,,Cultural,C,Venezuela (Bolivarian Republic of),Latin America and the Caribbean,ve,ven829,701,Canaima National Park,1994,,-61,5,5,33333,3000000,Natural,N,Venezuela (Bolivarian Republic of),Latin America and the Caribbean,ve,ven1150,986,Ciudad Universitaria de Caracas,2000,,-66,89068,10,49073,164203,Cultural,C,Venezuela (Bolivarian Republic of),Latin America and the Caribbean,ve,ven796,672,Ha Long Bay,1994,,107,1,20,9,150000,Natural,N,Viet Nam,Asia and the Pacific,vn,vnm802,678,Complex of Hué Monuments,1993,,107,57778,16,46944,315,47,Cultural,C,Viet Nam,Asia and the Pacific,vn,vnm1109,948,Hoi An Ancient Town,1999,,108,3333333,15,88333333,30,Cultural,C,Viet Nam,Asia and the Pacific,vn,vnm1110,949,My Son Sanctuary,1999,,108,5666667,15,51666667,142,Cultural,C,Viet Nam,Asia and the Pacific,vn,vnm2059,951,Phong Nha – Ke Bang National Park,2003,,106,15125,17,53722222,123326,Natural,N,Viet Nam,Asia and the Pacific,vn,vnm1689,1328,Central Sector of the Imperial Citadel of Thang Long - Hanoi,2010,,105,8372222,21,03944444,18,395,Cultural,C,Viet Nam,Asia and the Pacific,vn,vnm1775,1358,Citadel of the Ho Dynasty,2011,,105,6047222,20,07805556,155,5,Cultural,C,Viet Nam,Asia and the Pacific,vn,vnm1981,1438,Trang An Landscape Complex,2014,,105,8963889,20,25666667,6172,Mixed,C/N,Viet Nam,Asia and the Pacific,vn,vnm213,192,Old Walled City of Shibam,1982,,48,62667,15,92694,0,Cultural,C,Yemen,Arab States,ye,yem444,385,Old City of Sana'a,1986,,44,20805556,15,35555556,0,Cultural,C,Yemen,Arab States,ye,yem725,611,Historic Town of Zabid,1993,Y 2000,43,33,14,19806,0,Cultural,C,Yemen,Arab States,ye,yem1548,1263,Socotra Archipelago,2008,,53,83333333,12,5,410460,Natural,N,Yemen,Arab States,ye,yem339,302,Mana Pools National Park, Sapi and Chewore Safari Areas,1984,,29,40805556,-15,81944444,676600,Natural,N,Zimbabwe,Africa,zw,zwe345,306,Matobo Hills,2003,,28,5,-20,5,205000,Cultural,C,Zimbabwe,Africa,zw,zwe417,364,Great Zimbabwe National Monument,1986,,30,93333333,-20,28333333,722,Cultural,C,Zimbabwe,Africa,zw,zwe418,365,Khami Ruins National Monument,1986,,28,37666667,-20,15833333,0,Cultural,C,Zimbabwe,Africa,zw,zwe214,193,Tipasa,1982,P 2002-2006,2,383333333,36,55,52,16,Cultural,C,Algeria,Algeria,Arab States,dz,dza198,179,Tassili n'Ajjer,1982,,9,25,5,7200000,Mixed,C/N,Algeria,Algeria,Algeria,Algeria,Arab States,dz,dza1092,937,Península Valdés,1999,,-64,-42,5,360000,Natural,N,Argentina,Argentina,Argentina,Argentina,Latin America and the Caribbean,ar,arg2003,1459,Qhapaq Ñan, Andean Road System,2014,,-69,59166667,-18,25,11406,95,Cultural,C,Argentina,Bolivia (Plurinational State of),Chile,Colombia,Ecuador,Peru,Latin America and the Caribbean,ar,arg326,275,Jesuit Missions of the Guaranis: San Ignacio Mini, Santa Ana, Nuestra Señora de Loreto and Santa Maria Mayor (Argentina), Ruins of Sao Miguel das Missoes (Brazil),1983,,-54,26583333,-28,54333333,0,Cultural,C,Argentina,Brazil,Latin America and the Caribbean,ar,arg1950,181,Tasmanian Wilderness,1982,,145,4166667,-41,58333333,1584233,Mixed,C/N,Australia,Australia,Asia and the Pacific,au,aus565,486,Wet Tropics of Queensland,1988,,144,9666667,-15,65,893453,Natural,N,Australia,Australia,Asia and the Pacific,au,aus683,577,Heard and McDonald Islands,1997,,73,5,-53,1,658903,Natural,N,Australia,Australia,Asia and the Pacific,au,aus747,629,Macquarie Island,1997,,158,8955556,-54,59472222,540000,Natural,N,Australia,Australia,Asia and the Pacific,au,aus172,154,Great Barrier Reef,1981,,147,7,-18,28611111,34870000,Natural,N,Australia,Australia,Australia,Asia and the Pacific,au,aus1782,1363,Prehistoric Pile dwellings around the Alps,2011,,8,2075,47,27833333,274,2,Cultural,C,Austria,France,Germany,Italy,Slovenia,Switzerland,Europe and North America,at,aut913,772,Fertö / Neusiedlersee Cultural Landscape,2001,,16,72272222,47,71927778,68369,Cultural,C,Austria,Hungary,Europe and North America,at,aut943,798,The Sundarbans,1997,,89,18333,21,95,139500,Natural,N,Bangladesh,Bangladesh,Asia and the Pacific,bd,bgd2005,33,Bia_owie_a Forest  ,1979,,23,98111111,52,7275,,Natural,N,Belarus,Belarus,Poland,Poland,Europe and North America,by,blr1364,1187,Struve Geodetic Arc,2005,,26,33777778,59,05777778,0,Cultural,C,Belarus,Estonia,Finland,Latvia,Lithuania,Norway,Republic of Moldova,Russian Federation,Sweden,Ukraine,Europe and North America,by,blr1100,943,Belfries of Belgium and France,1999,,3,23139,50,17444,0,Cultural,C,Belgium,France,Europe and North America,be,bel1920,1380,Sangha Trinational,2012,,16,55416667,2,609444444,746309,Natural,N,Cameroon,Central African Republic,Congo,Africa,cm,cmr342,304,Canadian Rocky Mountain Parks,1984,,-116,4797222,51,42472222,2299104,Natural,N,Canada,Canada,Europe and North America,ca,can78,72,Kluane / Wrangell-St. Elias / Glacier Bay / Tatshenshini-Alsek,1979,,-140,9919722,61,19758333,9839121,Natural,N,Canada,Canada,Canada,United States of America,United States of America,United States of America,Europe and North America,ca,can407,354,Waterton Glacier International Peace Park,1995,,-113,9041667,48,99605556,457614,Natural,N,Canada,Canada,United States of America,United States of America,Europe and North America,ca,can1985,1442,Silk Roads: the Routes Network of Chang'an-Tianshan Corridor,2014,,108,8572222,34,30444444,42668,16,Cultural,C,China,Kazakhstan,Kyrgyzstan,Asia and the Pacific,cn,chn1083,928,Area de Conservación Guanacaste,1999,,-85,61666667,10,85,147000,Natural,N,Costa Rica,Costa Rica,Latin America and the Caribbean,cr,cri226,205,Talamanca Range-La Amistad Reserves / La Amistad National Park,1983,,-82,93880556,9,407083333,570045,Natural,N,Costa Rica,Panama,Latin America and the Caribbean,cr,cri216,195,Taï National Park,1982,,-7,66667,5,75,330000,Natural,N,Côte d'Ivoire,Côte d'Ivoire,Africa,ci,civ252,227,Comoé National Park,1983,Y 2003,-4,9,1150000,Natural,N,Côte d'Ivoire,Côte d'Ivoire,Africa,ci,civ173,155,Mount Nimba Strict Nature Reserve,1981,Y 1992,-8,39097,7,60318,18000,Natural,N,Côte d'Ivoire,Guinea,Africa,ci,civ225,204,Old Havana and its Fortification System,1982,,-82,35,23,13333333,142,5,Cultural,C,Cuba,Cuba,Latin America and the Caribbean,cu,cub535,460,Trinidad and the Valley de los Ingenios,1988,,-79,98444444,21,80305556,0,Cultural,C,Cuba,Cuba,Latin America and the Caribbean,cu,cub989,839,Alejandro de Humboldt National Park,2001,,-75,20,45,71140,Natural,N,Cuba,Cuba,Latin America and the Caribbean,cu,cub1178,1008,Archaeological Landscape of the First Coffee Plantations in the South-East of Cuba,2000,,-75,39138889,20,03,81475,Cultural,C,Cuba,Cuba,Latin America and the Caribbean,cu,cub401,351,Painted Churches in the Troodos Region,1985,,33,09583333,34,92027778,0,Cultural,C,Cyprus,Cyprus,Europe and North America,cy,cyp1967,1314,Wadden Sea,2009,,8,556111111,53,52861111,,Natural,N,Denmark,Germany,Netherlands,Europe and North America,dk,dnk615,526,Colonial City of Santo Domingo,1990,,-69,91666667,18,48333333,106,Cultural,C,Dominican Republic,Dominican Republic,Latin America and the Caribbean,do,dom4,1,Galápagos Islands,1978,P 2007-2010,-91,-0,81667,14066514,Natural,N,Ecuador,Ecuador,Latin America and the Caribbean,ec,ecu290,260,Sangay National Park,1983,P 1992-2005,-78,33333,-1,83333,271925,Natural,N,Ecuador,Ecuador,Latin America and the Caribbean,ec,ecu1363,1186,Wadi Al-Hitan (Whale Valley),2005,,30,18333,29,33333,20015,Natural,N,Egypt,Egypt,Arab States,eg,egy690,583,Fortress of Suomenlinna,1991,,24,98722,60,14722,210,Cultural,C,Finland,Finland,Europe and North America,fi,fin691,584,Petäjävesi Old Church,1994,,25,18333,62,25,0,Cultural,C,Finland,Finland,Europe and North America,fi,fin885,751,Verla Groundwood and Board Mill,1996,,26,64083,61,06194,22,778,Cultural,C,Finland,Finland,Europe and North America,fi,fin1050,898,High Coast / Kvarken Archipelago,2000,,21,3,63,3,336900,Natural,N,Finland,Sweden,Europe and North America,fi,fin915,773,Pyrénées - Mont Perdu,1997,,-0,0005,42,68542,30639,Mixed,C/N,France,Spain,Europe and North America,fr,fra1403,1226,Stone Circles of Senegambia,2006,,-15,5225,13,69111111,9,85,Cultural,C,Gambia,Senegal,Africa,gm,gmb1307,1127,Muskauer Park / Park Mu_akowski,2004,,14,72644444,51,57930556,348,Cultural,C,Germany,Poland,Europe and North America,de,deu1777,1133,Primeval Beech Forests of the Carpathians and the Ancient Beech Forests of  Germany,2007,,22,53611111,49,08611111,33670,2,Natural,N,Germany,Slovakia,Ukraine,Europe and North America,de,deu1539,430,Frontiers of the Roman Empire,1987,,-2,601,54,99261111,526,9,Cultural,C,Germany,United Kingdom of Great Britain and Northern Ireland,Europe and North America,de,deu38,34,Forts and Castles, Volta, Greater Accra, Central and Western Regions,1979,,-0,49361,5,39103,0,Cultural,C,Ghana,Ghana,Africa,gh,gha98,91,Historic Centre of Rome, the Properties of the Holy See in that City Enjoying Extraterritorial Rights and San Paolo Fuori le Mura,1980,,12,49230556,41,89022222,1485,1,Cultural,C,Holy See,Italy,Europe and North America,va,vat1624,725,Caves of Aggtelek Karst and Slovak Karst,1995,,20,48687,48,47573,56650,57,Natural,N,Hungary,Slovakia,Europe and North America,hu,hun524,452,Sundarbans National Park,1987,,88,89583333,21,945,133010,Natural,N,India,India,Asia and the Pacific,in,ind1344,1167,Tropical Rainforest Heritage of Sumatra,2004,,101,5,-2,5,2595124,Natural,N,Indonesia,Indonesia,Asia and the Pacific,id,idn1118,955,Lorentz National Park,1999,,137,83333,-4,75,2350000,Natural,N,Indonesia,Indonesia,Indonesia,Indonesia,Asia and the Pacific,id,idn723,609,Komodo National Park,1991,,119,48944,-8,54333,219322,Natural,N,Indonesia,Indonesia,Indonesia,Indonesia,Indonesia,Asia and the Pacific,id,idn892,757,Sceilg Mhichíl,1996,,-10,53861,51,77194,21,9,Cultural,C,Ireland,Ireland,Europe and North America,ie,irl1643,1090,Monte San Giorgio,2003,,8,913888889,45,88888889,1089,34,Natural,N,Italy,Switzerland,Europe and North America,it,ita1503,1276,Rhaetian Railway in the Albula / Bernina Landscapes,2008,,9,846388889,46,49833333,152,42,Cultural,C,Italy,Switzerland,Europe and North America,it,ita1001,850,Ouadi Qadisha (the Holy Valley) and the Forest of the Cedars of God (Horsh Arz el-Rab),1998,,36,04889,34,24333,0,Cultural,C,Lebanon,Lebanon,Arab States,lb,lbn1885,985,Maloti-Drakensberg Park,2000,,29,12305556,-29,76527778,249313,Mixed,C/N,Lesotho,South Africa,Africa,ls,lso1158,994,Curonian Spit,2000,,20,96239,55,27458,33021,Cultural,C,Lithuania,Lithuania,Russian Federation,Russian Federation,Europe and North America,lt,ltu576,494,Tsingy de Bemaraha Strict Nature Reserve,1990,,44,75,-18,66667,152000,Natural,N,Madagascar,Madagascar,Africa,mg,mdg1111,950,Royal Hill of Ambohimanga,2001,,47,56278,-18,75917,59,Cultural,C,Madagascar,Madagascar,Africa,mg,mdg145,132,Megalithic Temples of Malta,1980,,14,26947,36,04908,0,Cultural,C,Malta,Malta,Malta,Europe and North America,mt,mlt884,750,Ancient <I>Ksour</I> of Ouadane, Chinguetti, Tichitt and Oualata,1996,,-11,62361,20,92889,0,Cultural,C,Mauritania,Mauritania,Arab States,mr,mrt1404,1227,Aapravasi Ghat,2006,,57,50316667,-20,15863889,0,164,Cultural,C,Mauritius,Mauritius,Mauritius,Africa,mu,mus909,769,Uvs Nuur Basin,2003,,92,71972222,50,275,898063,5,Natural,N,Mongolia,Mongolia,Russian Federation,Russian Federation,Asia and the Pacific,mn,mng132,120,Sagarmatha National Park,1979,,86,91306,27,96528,124400,Natural,N,Nepal,Nepal,Nepal,Asia and the Pacific,np,npl872,739,Schokland and Surroundings,1995,,5,771666667,52,63861111,1306,Cultural,C,Netherlands,Netherlands,Europe and North America,nl,nld894,759,Defence Line of Amsterdam,1996,,4,893055556,52,37444444,14953,3,Cultural,C,Netherlands,Netherlands,Europe and North America,nl,nld966,818,Mill Network at Kinderdijk-Elshout,1997,,4,649444444,51,8825,0,Cultural,C,Netherlands,Netherlands,Europe and North America,nl,nld1018,867,Ir.D.F. Woudagemaal (D.F. Wouda Steam Pumping Station),1998,,5,67889,52,84583,7,32,Cultural,C,Netherlands,Netherlands,Europe and North America,nl,nld1051,899,Droogmakerij de Beemster (Beemster Polder),1999,,4,911111111,52,54888889,0,Cultural,C,Netherlands,Netherlands,Europe and North America,nl,nld487,421,Tongariro National Park,1990,,175,5622222,-39,29083333,79596,Mixed,C/N,New Zealand,New Zealand,New Zealand,Asia and the Pacific,nz,nzl648,551,Te Wahipounamu – South West New Zealand,1990,,167,3196111,-45,03602778,2600000,Natural,N,New Zealand,New Zealand,New Zealand,Asia and the Pacific,nz,nzl678,573,Air and Ténéré Natural Reserves,1991,Y 1992,9,18,7736000,Natural,N,Niger,Niger,Africa,ne,ner63,59,Bryggen,1979,,5,32306,60,39722,0,Cultural,C,Norway,Norway,Norway,Europe and North America,no,nor